issuer_name,disclosure_desc,link,date_posted
AVRA VALLEY FIRE DISTRICT OF PIMA AND PINAL COUNTIES,Annual Financial Information and Operating Data,https://emma.msrb.org/MarketActivity/ContinuingDisclosureDetails/P21097273,02/21/2021
"BOARD OF EDUCATION OF THE URBANA CITY SCHOOL DISTRICT, COUNTY OF CHAMPAIGN, OHIO",Annual Financial Information and Operating Data,https://emma.msrb.org/MarketActivity/ContinuingDisclosureDetails/P21097291,02/21/2021
"CITY OF TUPELO, MISSISSIPPI",Annual Financial Information and Operating Data,https://emma.msrb.org/MarketActivity/ContinuingDisclosureDetails/P21097284,02/21/2021
"DEER PARK COMMUNITY CITY SCHOOL DISTRICT BOARD OF EDUCATION (HAMILTON COUNTY, OHIO)",Annual Financial Information and Operating Data,https://emma.msrb.org/MarketActivity/ContinuingDisclosureDetails/P21097283,02/21/2021
"DEER PARK COMMUNITY CITY SCHOOL DISTRICT BOARD OF EDUCATION HAMILTON COUNTY, OHIO",Annual Financial Information and Operating Data,https://emma.msrb.org/MarketActivity/ContinuingDisclosureDetails/P21097283,02/21/2021
"DEER PARK COMMUNITY CITY SCHOOL DISTRICT HAMILTON COUNTY, OHIO",Annual Financial Information and Operating Data,https://emma.msrb.org/MarketActivity/ContinuingDisclosureDetails/P21097283,02/21/2021
"EATON COMMUNITY CITY SCHOOL DISTRICT COUNTY OF PREBLE, OHIO",Annual Financial Information and Operating Data,https://emma.msrb.org/MarketActivity/ContinuingDisclosureDetails/P21097289,02/21/2021
"EATON COMMUNITY CITY SCHOOL DISTRICT OHIO, COUNTY OF PREBLE",Annual Financial Information and Operating Data,https://emma.msrb.org/MarketActivity/ContinuingDisclosureDetails/P21097289,02/21/2021
"EATON COMMUNITY CITY SCHOOL DISTRICT, OHIO",Annual Financial Information and Operating Data,https://emma.msrb.org/MarketActivity/ContinuingDisclosureDetails/P21097289,02/21/2021
EATON OHIO CITY SCH DIST,Annual Financial Information and Operating Data,https://emma.msrb.org/MarketActivity/ContinuingDisclosureDetails/P21097289,02/21/2021
EATON OHIO CMNTY CITY SCHS,Annual Financial Information and Operating Data,https://emma.msrb.org/MarketActivity/ContinuingDisclosureDetails/P21097289,02/21/2021
"LIMA CITY SCHOOL DISTRICT, OHIO",Annual Financial Information and Operating Data,https://emma.msrb.org/MarketActivity/ContinuingDisclosureDetails/P21097292,02/21/2021
LIMA OHIO CITY SCH DIST,Annual Financial Information and Operating Data,https://emma.msrb.org/MarketActivity/ContinuingDisclosureDetails/P21097292,02/21/2021
"LUCERNE ELEMENTARY SCHOOL DISTRICT (LAKE COUNTY, CALIFORNIA)",Annual Financial Information and Operating Data,https://emma.msrb.org/MarketActivity/ContinuingDisclosureDetails/P21097280,02/21/2021
"MIAMI EAST LOCAL SCHOOL DISTRICT, COUNTIES OF MIAMI AND CHAMPAIGN, OHIO",Annual Financial Information and Operating Data,https://emma.msrb.org/MarketActivity/ContinuingDisclosureDetails/P21097290,02/21/2021
MIAMI EAST OHIO LOC SCH DIST,Annual Financial Information and Operating Data,https://emma.msrb.org/MarketActivity/ContinuingDisclosureDetails/P21097290,02/21/2021
MISSISSIPPI DEV BK SPL OBLIG,Annual Financial Information and Operating Data,https://emma.msrb.org/MarketActivity/ContinuingDisclosureDetails/P21097284,02/21/2021
MISSISSIPPI DEVELOPMENT BANK,Annual Financial Information and Operating Data,https://emma.msrb.org/MarketActivity/ContinuingDisclosureDetails/P21097284,02/21/2021
"PIONEER CAREER & TECHNOLOGY CENTER COUNTIES OF RICHLAND, CRAWFORD, MORROW, HURON, SENECA, WYANDOT, MARION & ASHLAND, OHIO",Annual Financial Information and Operating Data,https://emma.msrb.org/MarketActivity/ContinuingDisclosureDetails/P21097286,02/21/2021
"SCHOOL DISTRICT OF JOHNSON CREEK JEFFERSON COUNTY, WISCONSIN",Annual Financial Information and Operating Data,https://emma.msrb.org/MarketActivity/ContinuingDisclosureDetails/P21097274,02/21/2021
"SCHOOL DISTRICT OF JOHNSON CREEK JEFFERSON COUNTY, WISCONSIN",Annual Financial Information and Operating Data,https://emma.msrb.org/MarketActivity/ContinuingDisclosureDetails/P21097274,02/21/2021
"SCHOOL DISTRICT OF JOHNSON CREEK, WISCONSIN",Annual Financial Information and Operating Data,https://emma.msrb.org/MarketActivity/ContinuingDisclosureDetails/P21097274,02/21/2021
SEELEY UNION ELEMENTARY SCHOOL DISTRICT,Annual Financial Information and Operating Data,https://emma.msrb.org/MarketActivity/ContinuingDisclosureDetails/P21097279,02/21/2021
"SIDNEY CITY SCHOOL DISTRICT COUNTIES OF SHELBY AND LOGAN, OHIO",Annual Financial Information and Operating Data,https://emma.msrb.org/MarketActivity/ContinuingDisclosureDetails/P21097288,02/21/2021
SIDNEY OHIO CITY SCH DIST,Annual Financial Information and Operating Data,https://emma.msrb.org/MarketActivity/ContinuingDisclosureDetails/P21097288,02/21/2021
TUPELO MISS,Annual Financial Information and Operating Data,https://emma.msrb.org/MarketActivity/ContinuingDisclosureDetails/P21097284,02/21/2021
WEAVER CALIF UN SCH DIST,Annual Financial Information and Operating Data,https://emma.msrb.org/MarketActivity/ContinuingDisclosureDetails/P21097275,02/21/2021
WEAVER CALIF UN SCH DIST CTFS PARTN,Annual Financial Information and Operating Data,https://emma.msrb.org/MarketActivity/ContinuingDisclosureDetails/P21097275,02/21/2021
"WEAVER UNION SCHOOL DISTRICT (MERCED COUNTY, CALIFORNIA)",Annual Financial Information and Operating Data,https://emma.msrb.org/MarketActivity/ContinuingDisclosureDetails/P21097275,02/21/2021
"WEAVER UNION SCHOOL DISTRICT, CALIFORNIA",Annual Financial Information and Operating Data,https://emma.msrb.org/MarketActivity/ContinuingDisclosureDetails/P21097275,02/21/2021
