issuer_name,disclosure_desc,link,date_posted
COOK CNTY ILL CMNTY CONS SCH DIST NO 065 EVANSTON,Annual Financial Information and Operating Data,https://emma.msrb.org/MarketActivity/ContinuingDisclosureDetails/P11112150,01/26/2021
COOK CNTY ILL CMNTY HIGH SCH DIST NO 219 NILES TWP,Annual Financial Information and Operating Data,https://emma.msrb.org/MarketActivity/ContinuingDisclosureDetails/P31079015,01/26/2021
COOK CNTY ILL SCH DIST NO 102 LA GRANGE,Annual Financial Information and Operating Data,https://emma.msrb.org/MarketActivity/ContinuingDisclosureDetails/P11112345,01/26/2021
COOK CNTY ILL SCH DIST NO 123 OAK LAWN,Annual Financial Information and Operating Data,https://emma.msrb.org/MarketActivity/ContinuingDisclosureDetails/P31078700,01/26/2021
COOK CNTY ILL SCH DIST NO 147 WEST HARVEY DIXMOOR,Annual Financial Information and Operating Data,https://emma.msrb.org/MarketActivity/ContinuingDisclosureDetails/P31079148,01/26/2021
"CORALVILLE, CITY OF, IOWA",Annual Financial Information and Operating Data,https://emma.msrb.org/MarketActivity/ContinuingDisclosureDetails/P11112564,01/26/2021
"CORALVILLE, IOWA",Annual Financial Information and Operating Data,https://emma.msrb.org/MarketActivity/ContinuingDisclosureDetails/P11112564,01/26/2021
CORONA-NORCO CALIF UNI SCH DIST,Annual Financial Information and Operating Data,https://emma.msrb.org/MarketActivity/ContinuingDisclosureDetails/P11112430,01/26/2021
CORONA-NORCO CALIF UNI SCH DIST,Annual Financial Information and Operating Data,https://emma.msrb.org/MarketActivity/ContinuingDisclosureDetails/P11112450,01/26/2021
CORONA-NORCO UNIFIED SCHOOL DISTRICT,Annual Financial Information and Operating Data,https://emma.msrb.org/MarketActivity/ContinuingDisclosureDetails/P11112464,01/26/2021
CORONA-NORCO UNIFIED SCHOOL DISTRICT,Annual Financial Information and Operating Data,https://emma.msrb.org/MarketActivity/ContinuingDisclosureDetails/P11112458,01/26/2021
"CORONA-NORCO UNIFIED SCHOOL DISTRICT (RIVERSIDE COUNTY, CALIFORNIA)",Annual Financial Information and Operating Data,https://emma.msrb.org/MarketActivity/ContinuingDisclosureDetails/P11112458,01/26/2021
"CORONA-NORCO UNIFIED SCHOOL DISTRICT (RIVERSIDE COUNTY, CALIFORNIA)",Annual Financial Information and Operating Data,https://emma.msrb.org/MarketActivity/ContinuingDisclosureDetails/P11112464,01/26/2021
"CORONA-NORCO UNIFIED SCHOOL DISTRICT (RIVERSIDE, CA)",Annual Financial Information and Operating Data,https://emma.msrb.org/MarketActivity/ContinuingDisclosureDetails/P11112450,01/26/2021
CORONA-NORCO USD (RIVERSIDE COUNTY) CALIFORNIA,Annual Financial Information and Operating Data,https://emma.msrb.org/MarketActivity/ContinuingDisclosureDetails/P11112450,01/26/2021
"COUNTY OF BOURBON, KENTUCKY",Annual Financial Information and Operating Data,https://emma.msrb.org/MarketActivity/ContinuingDisclosureDetails/P11112507,01/26/2021
"COUNTY OF DURHAM, NORTH CAROLINA",Annual Financial Information and Operating Data,https://emma.msrb.org/MarketActivity/ContinuingDisclosureDetails/P11112299,01/26/2021
COUNTY OF FORSYTH NORTH CAROLINA,Annual Financial Information and Operating Data,https://emma.msrb.org/MarketActivity/ContinuingDisclosureDetails/P31079136,01/26/2021
"COUNTY OF FORSYTH, NORTH CAROLINA",Annual Financial Information and Operating Data,https://emma.msrb.org/MarketActivity/ContinuingDisclosureDetails/P31079136,01/26/2021
COUNTY OF GRANVILLE,Annual Financial Information and Operating Data,https://emma.msrb.org/MarketActivity/ContinuingDisclosureDetails/P31079003,01/26/2021
"COUNTY OF NORFOLK, MASSACHUSETTS",Annual Financial Information and Operating Data,https://emma.msrb.org/MarketActivity/ContinuingDisclosureDetails/P31079082,01/26/2021
"COUNTY OF ROWAN, KENTUCKY",Annual Financial Information and Operating Data,https://emma.msrb.org/MarketActivity/ContinuingDisclosureDetails/P11112533,01/26/2021
"COUNTY OF TAYLOR, KENTUCKY",Annual Financial Information and Operating Data,https://emma.msrb.org/MarketActivity/ContinuingDisclosureDetails/P11112541,01/26/2021
"COUNTY OF WOODFORD, KENTUCKY",Annual Financial Information and Operating Data,https://emma.msrb.org/MarketActivity/ContinuingDisclosureDetails/P11112550,01/26/2021
"DECATUR SCHOOL DISTRICT NUMBER 61 MACON COUNTY, ILLINOIS",Annual Financial Information and Operating Data,https://emma.msrb.org/MarketActivity/ContinuingDisclosureDetails/P11112413,01/26/2021
DENNIS & YARMOUTH MASS REGL SCH DIST,Annual Financial Information and Operating Data,https://emma.msrb.org/MarketActivity/ContinuingDisclosureDetails/P31079248,01/26/2021
DENNIS MASS,Annual Financial Information and Operating Data,https://emma.msrb.org/MarketActivity/ContinuingDisclosureDetails/P31079248,01/26/2021
"DENNIS-YARMOUTH REGIONAL SCHOOL DISTRICT, MASSACHUSETTS",Annual Financial Information and Operating Data,https://emma.msrb.org/MarketActivity/ContinuingDisclosureDetails/P31079248,01/26/2021
"DERRY TOWNSHIP DAUPHIN COUNTY, PENNSYLVANIA",Annual Financial Information and Operating Data,https://emma.msrb.org/MarketActivity/ContinuingDisclosureDetails/P11072191,01/26/2021
"DERRY TOWNSHIP DAUPHIN COUNTY, PENNSYLVANIA",Annual Financial Information and Operating Data,https://emma.msrb.org/MarketActivity/ContinuingDisclosureDetails/P31079255,01/26/2021
DERRY TOWNSHIP MUNI AUTHORITY PENNSYLVANIA,Annual Financial Information and Operating Data,https://emma.msrb.org/MarketActivity/ContinuingDisclosureDetails/P11072191,01/26/2021
DERRY TOWNSHIP MUNI AUTHORITY PENNSYLVANIA,Annual Financial Information and Operating Data,https://emma.msrb.org/MarketActivity/ContinuingDisclosureDetails/P31079255,01/26/2021
"DERRY TOWNSHIP MUNICIPAL AUTHORITY DAUPHIN COUNTY, PENNSYLVANIA",Annual Financial Information and Operating Data,https://emma.msrb.org/MarketActivity/ContinuingDisclosureDetails/P11072191,01/26/2021
"DERRY TOWNSHIP MUNICIPAL AUTHORITY DAUPHIN COUNTY, PENNSYLVANIA",Annual Financial Information and Operating Data,https://emma.msrb.org/MarketActivity/ContinuingDisclosureDetails/P31079255,01/26/2021
DERRY TOWNSHIP PENNSYLVANIA,Annual Financial Information and Operating Data,https://emma.msrb.org/MarketActivity/ContinuingDisclosureDetails/P11072191,01/26/2021
DERRY TWP PA,Annual Financial Information and Operating Data,https://emma.msrb.org/MarketActivity/ContinuingDisclosureDetails/P11072191,01/26/2021
DERRY TWP PA MUN AUTH SWR REV,Annual Financial Information and Operating Data,https://emma.msrb.org/MarketActivity/ContinuingDisclosureDetails/P11072191,01/26/2021
DERRY TWP PA MUN AUTH SWR REV,Annual Financial Information and Operating Data,https://emma.msrb.org/MarketActivity/ContinuingDisclosureDetails/P31079255,01/26/2021
DOUGLAS CNTY NEB SAN & IMPT DIST NO 521,Annual Financial Information and Operating Data,https://emma.msrb.org/MarketActivity/ContinuingDisclosureDetails/P31079001,01/26/2021
DUBUQUE IOWA,Annual Financial Information and Operating Data,https://emma.msrb.org/MarketActivity/ContinuingDisclosureDetails/P11112433,01/26/2021
"DUBUQUE, IA",Annual Financial Information and Operating Data,https://emma.msrb.org/MarketActivity/ContinuingDisclosureDetails/P11112433,01/26/2021
"DUPAGE COUNTY, IL, ROSELLE SCHOOL DISTRICT #12",Annual Financial Information and Operating Data,https://emma.msrb.org/MarketActivity/ContinuingDisclosureDetails/P31078865,01/26/2021
DURHAM CAPITAL FINANCING CORPORATION,Annual Financial Information and Operating Data,https://emma.msrb.org/MarketActivity/ContinuingDisclosureDetails/P11112299,01/26/2021
"DURHAM CAPITAL FINANCING CORPORATION (COUNTY OF DURHAM, NORTH CAROLINA)",Annual Financial Information and Operating Data,https://emma.msrb.org/MarketActivity/ContinuingDisclosureDetails/P11112299,01/26/2021
"DURHAM CAPITAL FINANCING CORPORATION (DURHAM COUNTY, NORTH CAROLINA",Annual Financial Information and Operating Data,https://emma.msrb.org/MarketActivity/ContinuingDisclosureDetails/P11112299,01/26/2021
DURHAM CNTY N C,Annual Financial Information and Operating Data,https://emma.msrb.org/MarketActivity/ContinuingDisclosureDetails/P11112299,01/26/2021
DURHAM CNTY N C ENTERPRISE SYS REV,Annual Financial Information and Operating Data,https://emma.msrb.org/MarketActivity/ContinuingDisclosureDetails/P11112299,01/26/2021
"DURHAM COUNTY, NORTH CAROLINA",Annual Financial Information and Operating Data,https://emma.msrb.org/MarketActivity/ContinuingDisclosureDetails/P11112299,01/26/2021
DUXBURY MASS,Annual Financial Information and Operating Data,https://emma.msrb.org/MarketActivity/ContinuingDisclosureDetails/P31079118,01/26/2021
"EAST AURORA SCHOOL DISTRICT NUMBER 131, KANE COUNTY, ILLINOIS",Annual Financial Information and Operating Data,https://emma.msrb.org/MarketActivity/ContinuingDisclosureDetails/P31079215,01/26/2021
"EAST HAMPTON (TOWN OF), CONNECTICUT",Annual Financial Information and Operating Data,https://emma.msrb.org/MarketActivity/ContinuingDisclosureDetails/P31079151,01/26/2021
EAST TEX HSG FIN CORP SINGLE FAMILY MTG REV,Annual Financial Information and Operating Data,https://emma.msrb.org/MarketActivity/ContinuingDisclosureDetails/P11112459,01/26/2021
EASTERN ILL UNIV CTFS PARTN,Annual Financial Information and Operating Data,https://emma.msrb.org/MarketActivity/ContinuingDisclosureDetails/P11112165,01/26/2021
EASTERN ILL UNIV REVS,Annual Financial Information and Operating Data,https://emma.msrb.org/MarketActivity/ContinuingDisclosureDetails/P11112165,01/26/2021
"EASTSIDE UNION SCHOOL DISTRICT (LOS ANGELES COUNTY, CALIFORNIA)",Annual Financial Information and Operating Data,https://emma.msrb.org/MarketActivity/ContinuingDisclosureDetails/P31079063,01/26/2021
ELIZABETH CITY STATE UNIVERSITY,Annual Financial Information and Operating Data,https://emma.msrb.org/MarketActivity/ContinuingDisclosureDetails/P31079178,01/26/2021
ELIZABETH CITY STATE UNIVERSITY NC,Annual Financial Information and Operating Data,https://emma.msrb.org/MarketActivity/ContinuingDisclosureDetails/P31079178,01/26/2021
ELY INDEPENDENT SCHOOL DISTRICT NO.696,Annual Financial Information and Operating Data,https://emma.msrb.org/MarketActivity/ContinuingDisclosureDetails/P11112357,01/26/2021
"EVAN'S PLACE METROPOLITAN DISTRICT (IN THE TOWN OF KEENESBURG, COLORADO)",Annual Financial Information and Operating Data,https://emma.msrb.org/MarketActivity/ContinuingDisclosureDetails/P31079319,01/26/2021
EVANS CNTY GA HOSP AUTH REV,Annual Financial Information and Operating Data,https://emma.msrb.org/MarketActivity/ContinuingDisclosureDetails/P11112415,01/26/2021
"EVERGREEN FIRE DISTRICT FLATHEAD COUNTY, MONTANA",Annual Financial Information and Operating Data,https://emma.msrb.org/MarketActivity/ContinuingDisclosureDetails/P31079175,01/26/2021
FLORENCE COUNTY,Annual Financial Information and Operating Data,https://emma.msrb.org/MarketActivity/ContinuingDisclosureDetails/P31078949,01/26/2021
"FLORENCE COUNTY, SOUTH CAROLINA",Annual Financial Information and Operating Data,https://emma.msrb.org/MarketActivity/ContinuingDisclosureDetails/P31078949,01/26/2021
FLORIDA DEVELOPMENT FINANCE CORPORATION,Annual Financial Information and Operating Data,https://emma.msrb.org/MarketActivity/ContinuingDisclosureDetails/P31079158,01/26/2021
FORSYTH CNTY N C,Annual Financial Information and Operating Data,https://emma.msrb.org/MarketActivity/ContinuingDisclosureDetails/P31079136,01/26/2021
FORT BEND COUNTY MUNICIPAL UTILITY DISTRICT NO 5,Annual Financial Information and Operating Data,https://emma.msrb.org/MarketActivity/ContinuingDisclosureDetails/P11112187,01/26/2021
FORT BEND COUNTY MUNICIPAL UTILITY DISTRICT NO. 185,Annual Financial Information and Operating Data,https://emma.msrb.org/MarketActivity/ContinuingDisclosureDetails/P31078878,01/26/2021
"FORT BEND COUNTY MUNICIPAL UTILITY DISTRICT NO. 185, TEXAS",Annual Financial Information and Operating Data,https://emma.msrb.org/MarketActivity/ContinuingDisclosureDetails/P31078878,01/26/2021
"FORT BEND COUNTY MUNICIPAL UTILITY DISTRICT NO. 5 (A POLITICAL SUBDIVISION OF THE STATE OF TEXAS, LOCATED WITHIN FORT BEND COUNTY)",Annual Financial Information and Operating Data,https://emma.msrb.org/MarketActivity/ContinuingDisclosureDetails/P11112187,01/26/2021
FORT BEND COUNTY MUNICIPAL UTILITY DISTRICT NO. 5 TEXAS,Annual Financial Information and Operating Data,https://emma.msrb.org/MarketActivity/ContinuingDisclosureDetails/P11112187,01/26/2021
"FORT BEND COUNTY MUNICIPAL UTILITY DISTRICT NO. 5, TEXAS",Annual Financial Information and Operating Data,https://emma.msrb.org/MarketActivity/ContinuingDisclosureDetails/P11112187,01/26/2021
"FORT BEND COUNTY MUNICIPAL UTILITY DISTRICT NO. 5, TEXAS (A POLITICAL SUBDIVISION OF THE STATE OF TEXAS, LOCATED WITHIN FORT BEND COUNTY)",Annual Financial Information and Operating Data,https://emma.msrb.org/MarketActivity/ContinuingDisclosureDetails/P11112187,01/26/2021
"FORT BEND COUNTY MUNICIPAL UTILITY DISTRICT NO.185 (FORT BEND COUNTY, TEXAS)",Annual Financial Information and Operating Data,https://emma.msrb.org/MarketActivity/ContinuingDisclosureDetails/P31078878,01/26/2021
FRANKLIN CNTY KY SCH DIST FIN CORP SCH BLDG REV,Annual Financial Information and Operating Data,https://emma.msrb.org/MarketActivity/ContinuingDisclosureDetails/P11112305,01/26/2021
"FRANKLIN CO, KY",Annual Financial Information and Operating Data,https://emma.msrb.org/MarketActivity/ContinuingDisclosureDetails/P11112305,01/26/2021
FRANKLIN COUNTY PUBLIC PROPERTIES CORPORATION,Annual Financial Information and Operating Data,https://emma.msrb.org/MarketActivity/ContinuingDisclosureDetails/P11112514,01/26/2021
FRANKLIN COUNTY SCHOOL DISTRICT FINANCE CORPORATION,Annual Financial Information and Operating Data,https://emma.msrb.org/MarketActivity/ContinuingDisclosureDetails/P11112305,01/26/2021
"FRANKLIN COUNTY SCHOOL DISTRICT FINANCE CORPORATION, KENTUCKY",Annual Financial Information and Operating Data,https://emma.msrb.org/MarketActivity/ContinuingDisclosureDetails/P11112305,01/26/2021
"FRANKLIN COUNTY, KENTUCKY PUBLIC PROPERTIES CORPORATION",Annual Financial Information and Operating Data,https://emma.msrb.org/MarketActivity/ContinuingDisclosureDetails/P11112514,01/26/2021
"FRAZIER SCHOOL DISTRICT (FAYETTE COUNTY, PENNSYLVANIA)",Annual Financial Information and Operating Data,https://emma.msrb.org/MarketActivity/ContinuingDisclosureDetails/P11112370,01/26/2021
"FRAZIER SCHOOL DISTRICT, FAYETTE COUNTY, PENNSYLVANIA",Annual Financial Information and Operating Data,https://emma.msrb.org/MarketActivity/ContinuingDisclosureDetails/P11112370,01/26/2021
FREEMAN S D SCH DIST NO 33-1,Annual Financial Information and Operating Data,https://emma.msrb.org/MarketActivity/ContinuingDisclosureDetails/P31078880,01/26/2021
FREEMAN SCHOOL DISTRICT NO 33-1 SD,Annual Financial Information and Operating Data,https://emma.msrb.org/MarketActivity/ContinuingDisclosureDetails/P31078880,01/26/2021
"FREEMAN SCHOOL DISTRICT NO. 33-1 HUTCHINSON, MCCOOK AND TURNER COUNTIES, SOUTH DAKOTA",Annual Financial Information and Operating Data,https://emma.msrb.org/MarketActivity/ContinuingDisclosureDetails/P31078880,01/26/2021
"GALLUP MCKINLEY COUNTY SCHOOL DISTRICT NO. 1, NEW MEXICO",Annual Financial Information and Operating Data,https://emma.msrb.org/MarketActivity/ContinuingDisclosureDetails/P31079013,01/26/2021
GALLUP-MCKINLEY COUNTY SCHOOL DISTRICT NO. 1,Annual Financial Information and Operating Data,https://emma.msrb.org/MarketActivity/ContinuingDisclosureDetails/P31079013,01/26/2021
GALVESTON CNTY TEX MUN UTIL DIST NO 32,Annual Financial Information and Operating Data,https://emma.msrb.org/MarketActivity/ContinuingDisclosureDetails/P31079304,01/26/2021
"GALVESTON COUNTY MUNICIPAL UTILITY DISTRICT NO. 32, (A POLITICAL SUBDIVISION OF THE STATE OF TEXAS LOCATED IN GALVESTON COUNTY TEXAS)",Annual Financial Information and Operating Data,https://emma.msrb.org/MarketActivity/ContinuingDisclosureDetails/P31079304,01/26/2021
"GALVESTON COUNTY MUNICIPAL UTILITY DISTRICT NO. 32, TEXAS",Annual Financial Information and Operating Data,https://emma.msrb.org/MarketActivity/ContinuingDisclosureDetails/P31079304,01/26/2021
"GENEVA USD NUMBER 304, KANE COUNTY, IL COMMUNITY UNIT SCHOOL DISTRICT NUMBER 304",Annual Financial Information and Operating Data,https://emma.msrb.org/MarketActivity/ContinuingDisclosureDetails/P11112361,01/26/2021
"GLENDALE MUNICIPAL FINANCING AUTHORITY, CALIFORNIA",Annual Financial Information and Operating Data,https://emma.msrb.org/MarketActivity/ContinuingDisclosureDetails/P11112474,01/26/2021
GRAFTON MASS,Annual Financial Information and Operating Data,https://emma.msrb.org/MarketActivity/ContinuingDisclosureDetails/P31079086,01/26/2021
"GRANT ROAD PUBLIC UTILITY DISTRICT, TEXAS",Annual Financial Information and Operating Data,https://emma.msrb.org/MarketActivity/ContinuingDisclosureDetails/P31078945,01/26/2021
"GRANVILLE COUNTY PUBLIC FACILITIES COMPANY COUNTY OF GRANVILLE, NORTH CAROLINA",Annual Financial Information and Operating Data,https://emma.msrb.org/MarketActivity/ContinuingDisclosureDetails/P31079003,01/26/2021
"GRANVILLE COUNTY, NORTH CAROLINA",Annual Financial Information and Operating Data,https://emma.msrb.org/MarketActivity/ContinuingDisclosureDetails/P31079003,01/26/2021
HARDIN COUNTY IOWA,Annual Financial Information and Operating Data,https://emma.msrb.org/MarketActivity/ContinuingDisclosureDetails/P31079101,01/26/2021
"HARDIN COUNTY, IOWA",Annual Financial Information and Operating Data,https://emma.msrb.org/MarketActivity/ContinuingDisclosureDetails/P31079101,01/26/2021
HARRIS CNTY TEX IMPT DIST NO 15,Annual Financial Information and Operating Data,https://emma.msrb.org/MarketActivity/ContinuingDisclosureDetails/P31079312,01/26/2021
"HARRIS COUNTY IMPROVEMENT DISTRICT NO. 15, TEXAS",Annual Financial Information and Operating Data,https://emma.msrb.org/MarketActivity/ContinuingDisclosureDetails/P31079312,01/26/2021
HART CNTY KY,Annual Financial Information and Operating Data,https://emma.msrb.org/MarketActivity/ContinuingDisclosureDetails/P11112521,01/26/2021
"HART COUNTY PUBLIC PROPERTIES CORPORATION, KENTUCKY",Annual Financial Information and Operating Data,https://emma.msrb.org/MarketActivity/ContinuingDisclosureDetails/P11112521,01/26/2021
HAWAII HOUSING FINANCE AND DEVELOPMENT CORPORATION,Annual Financial Information and Operating Data,https://emma.msrb.org/MarketActivity/ContinuingDisclosureDetails/P31079320,01/26/2021
HAWAII ST HSG FIN & DEV CORP SINGLE FAMILY MTG PUR REV,Annual Financial Information and Operating Data,https://emma.msrb.org/MarketActivity/ContinuingDisclosureDetails/P31079320,01/26/2021
HIDALGO/WILLACY HSG FIN CORP TEX SINGLE FAMILY MTG REV,Annual Financial Information and Operating Data,https://emma.msrb.org/MarketActivity/ContinuingDisclosureDetails/P11112469,01/26/2021
HIGHLAND SCHOOL DISTRICT WISCONSIN,Annual Financial Information and Operating Data,https://emma.msrb.org/MarketActivity/ContinuingDisclosureDetails/P31078907,01/26/2021
"HIGHLAND SCHOOL DISTRICT, WISCONSIN",Annual Financial Information and Operating Data,https://emma.msrb.org/MarketActivity/ContinuingDisclosureDetails/P31078907,01/26/2021
HIGHLANDS CNTY FLA SCH BRD CTFS PARTN,Annual Financial Information and Operating Data,https://emma.msrb.org/MarketActivity/ContinuingDisclosureDetails/P31079065,01/26/2021
"HIGHLANDS COUNTY SCHOOL BOARD, FLORIDA",Annual Financial Information and Operating Data,https://emma.msrb.org/MarketActivity/ContinuingDisclosureDetails/P31079065,01/26/2021
HOPEDALE MASS,Annual Financial Information and Operating Data,https://emma.msrb.org/MarketActivity/ContinuingDisclosureDetails/P31079086,01/26/2021
HUMBOLDT IOWA,Annual Financial Information and Operating Data,https://emma.msrb.org/MarketActivity/ContinuingDisclosureDetails/P11112291,01/26/2021
"HUNTLEY AREA PUBLIC LIBRARY DISTRICT MCHENRY AND KANE COUNTIES, ILLINOIS",Annual Financial Information and Operating Data,https://emma.msrb.org/MarketActivity/ContinuingDisclosureDetails/P31078947,01/26/2021
ILLINOIS FINANCE AUTHORITY,Annual Financial Information and Operating Data,https://emma.msrb.org/MarketActivity/ContinuingDisclosureDetails/P31079129,01/26/2021
ILLINOIS FINANCE AUTHORITY,Annual Financial Information and Operating Data,https://emma.msrb.org/MarketActivity/ContinuingDisclosureDetails/P11112152,01/26/2021
ILLINOIS ST,Annual Financial Information and Operating Data,https://emma.msrb.org/MarketActivity/ContinuingDisclosureDetails/P31078992,01/26/2021
ILLINOIS ST SALES TAX REV,Annual Financial Information and Operating Data,https://emma.msrb.org/MarketActivity/ContinuingDisclosureDetails/P31078992,01/26/2021
"INDEPENDENT SCHOOL DISTRICT NO. 197 (WEST ST. PAUL-MENDOTA HEIGHTS-EAGAN), MINNESOTA",Annual Financial Information and Operating Data,https://emma.msrb.org/MarketActivity/ContinuingDisclosureDetails/P31079250,01/26/2021
"INDEPENDENT SCHOOL DISTRICT NO. 69 OF CANADIAN COUNTY, OKLAHOMA (MUSTANG SCHOOL DISTRICT)",Annual Financial Information and Operating Data,https://emma.msrb.org/MarketActivity/ContinuingDisclosureDetails/P31078925,01/26/2021
"INDEPENDENT SCHOOL DISTRICT NO. 696 (ELY), MINNESOTA",Annual Financial Information and Operating Data,https://emma.msrb.org/MarketActivity/ContinuingDisclosureDetails/P11112357,01/26/2021
INDIANA BD BK REV,Annual Financial Information and Operating Data,https://emma.msrb.org/MarketActivity/ContinuingDisclosureDetails/P11112365,01/26/2021
INDIANA BOND BANK,Annual Financial Information and Operating Data,https://emma.msrb.org/MarketActivity/ContinuingDisclosureDetails/P11112365,01/26/2021
INDIANA BOND BANK COMMON SCHOOL FUND,Annual Financial Information and Operating Data,https://emma.msrb.org/MarketActivity/ContinuingDisclosureDetails/P11112365,01/26/2021
INDIANA FINANCE AUTHORITY,Annual Financial Information and Operating Data,https://emma.msrb.org/MarketActivity/ContinuingDisclosureDetails/P31078948,01/26/2021
INDIANA FINANCE AUTHORITY,Annual Financial Information and Operating Data,https://emma.msrb.org/MarketActivity/ContinuingDisclosureDetails/P31079278,01/26/2021
"IOWA WESTERN COMMUNITY COLLEGE (MERGED AREA XIII), IOWA",Annual Financial Information and Operating Data,https://emma.msrb.org/MarketActivity/ContinuingDisclosureDetails/P11112559,01/26/2021
"IOWA WESTERN COMMUNITY COLLEGE, IOWA (MERGED AREA XIII)",Annual Financial Information and Operating Data,https://emma.msrb.org/MarketActivity/ContinuingDisclosureDetails/P11112559,01/26/2021
"IOWA WESTERN COMMUNITY COLLEGE, STATE OF IOWA",Annual Financial Information and Operating Data,https://emma.msrb.org/MarketActivity/ContinuingDisclosureDetails/P11112559,01/26/2021
"IOWA WESTERN COMMUNITY COLLEGE, STATE OF IOWA (MERGED AREA XIII)",Annual Financial Information and Operating Data,https://emma.msrb.org/MarketActivity/ContinuingDisclosureDetails/P11112559,01/26/2021
IOWA WESTN CMNTY COLLEGE MERGED AREA XIII,Annual Financial Information and Operating Data,https://emma.msrb.org/MarketActivity/ContinuingDisclosureDetails/P11112559,01/26/2021
KANE CNTY ILL CMNTY UNIT SCH DIST NO 304 GENEVA,Annual Financial Information and Operating Data,https://emma.msrb.org/MarketActivity/ContinuingDisclosureDetails/P11112361,01/26/2021
KANE CNTY ILL SCH DIST NO 131 AURORA EAST SIDE,Annual Financial Information and Operating Data,https://emma.msrb.org/MarketActivity/ContinuingDisclosureDetails/P31079215,01/26/2021
"KANE COUNTY, ILLINOIS, EAST AURORA SCHOOL DISTRICT NUMBER 131",Annual Financial Information and Operating Data,https://emma.msrb.org/MarketActivity/ContinuingDisclosureDetails/P31079215,01/26/2021
"KANE, MCHENRY, COOK AND DEKALB COUNTIES, ILLINOIS COMMUNITY UNIT SCHOOL DISTRICT NUMBER 300",Annual Financial Information and Operating Data,https://emma.msrb.org/MarketActivity/ContinuingDisclosureDetails/P11112154,01/26/2021
KAUFMAN CNTY TEX MUN UTIL DIST NO 006,Annual Financial Information and Operating Data,https://emma.msrb.org/MarketActivity/ContinuingDisclosureDetails/P31079051,01/26/2021
KAUFMAN CNTY TEX MUN UTIL DIST NO 2,Annual Financial Information and Operating Data,https://emma.msrb.org/MarketActivity/ContinuingDisclosureDetails/P31078923,01/26/2021
KAUFMAN CNTY TEX MUN UTIL DIST NO 5,Annual Financial Information and Operating Data,https://emma.msrb.org/MarketActivity/ContinuingDisclosureDetails/P31079033,01/26/2021
KAUFMAN COUNTY MUNICIPAL UTILITY DISTRICT NO. 2,Annual Financial Information and Operating Data,https://emma.msrb.org/MarketActivity/ContinuingDisclosureDetails/P31078923,01/26/2021
"KAUFMAN COUNTY MUNICIPAL UTILITY DISTRICT NO. 2, TEXAS",Annual Financial Information and Operating Data,https://emma.msrb.org/MarketActivity/ContinuingDisclosureDetails/P31078923,01/26/2021
KAUFMAN COUNTY MUNICIPAL UTILITY DISTRICT NO. 4 TEXAS,Annual Financial Information and Operating Data,https://emma.msrb.org/MarketActivity/ContinuingDisclosureDetails/P31078994,01/26/2021
"KAUFMAN COUNTY MUNICIPAL UTILITY DISTRICT NO. 4, TEXAS",Annual Financial Information and Operating Data,https://emma.msrb.org/MarketActivity/ContinuingDisclosureDetails/P31078994,01/26/2021
"KAUFMAN COUNTY MUNICIPAL UTILITY DISTRICT NO. 5, TEXAS",Annual Financial Information and Operating Data,https://emma.msrb.org/MarketActivity/ContinuingDisclosureDetails/P31079033,01/26/2021
KAUFMAN COUNTY MUNICIPAL UTILITY DISTRICT NO. 6,Annual Financial Information and Operating Data,https://emma.msrb.org/MarketActivity/ContinuingDisclosureDetails/P31079051,01/26/2021
KAUFMAN COUNTY MUNICIPAL UTILITY DISTRICT NO. 6 TEXAS,Annual Financial Information and Operating Data,https://emma.msrb.org/MarketActivity/ContinuingDisclosureDetails/P31079051,01/26/2021
"KAUFMAN COUNTY MUNICIPAL UTILITY DISTRICT NO. 6, TEXAS",Annual Financial Information and Operating Data,https://emma.msrb.org/MarketActivity/ContinuingDisclosureDetails/P31079051,01/26/2021
KENTUCKY BD CORP FING PROG REV,Annual Financial Information and Operating Data,https://emma.msrb.org/MarketActivity/ContinuingDisclosureDetails/P11112337,01/26/2021
