issuer_name,disclosure_desc,link,date_posted
-,Annual Financial Information and Operating Data,https://emma.msrb.org/MarketActivity/ContinuingDisclosureDetails/P11072191,01/26/2021
-,Annual Financial Information and Operating Data,https://emma.msrb.org/MarketActivity/ContinuingDisclosureDetails/P31079086,01/26/2021
-,Annual Financial Information and Operating Data,https://emma.msrb.org/MarketActivity/ContinuingDisclosureDetails/P31079065,01/26/2021
-,Annual Financial Information and Operating Data,https://emma.msrb.org/MarketActivity/ContinuingDisclosureDetails/P11112278,01/26/2021
AGOURA HILLS CALIF REDEV AGY HSG SET-ASIDE TAX ALLOC,Annual Financial Information and Operating Data,https://emma.msrb.org/MarketActivity/ContinuingDisclosureDetails/P11112599,01/26/2021
AGOURA HILLS CALIF REDEV AGY TAX ALLOC,Annual Financial Information and Operating Data,https://emma.msrb.org/MarketActivity/ContinuingDisclosureDetails/P11112598,01/26/2021
"AGOURA HILLS IMPROVEMENT AUTHORITY, CALIFORNIA",Annual Financial Information and Operating Data,https://emma.msrb.org/MarketActivity/ContinuingDisclosureDetails/P11112596,01/26/2021
AIRPORT COMMISSION OF THE CITY AND COUNTY OF SAN FRANCISCO,Annual Financial Information and Operating Data,https://emma.msrb.org/MarketActivity/ContinuingDisclosureDetails/P11112529,01/26/2021
AIRPORT COMMISSION OF THE CITY AND COUNTY OF SAN FRANCISCO,Annual Financial Information and Operating Data,https://emma.msrb.org/MarketActivity/ContinuingDisclosureDetails/P11112529,01/26/2021
AIRPORT COMMISSION OF THE CITY AND COUNTY OF SAN FRANCISCO SAN FRANCISCO INTERNATIONAL,Annual Financial Information and Operating Data,https://emma.msrb.org/MarketActivity/ContinuingDisclosureDetails/P11112529,01/26/2021
AIRPORT COMMISSION OF THE CITY AND COUNTY OF SAN FRANCISCO SAN FRANCISCO INTERNATIONAL AIRPORT,Annual Financial Information and Operating Data,https://emma.msrb.org/MarketActivity/ContinuingDisclosureDetails/P11112529,01/26/2021
"AMES COMMUNITY SCHOOL DISTRICT, IOWA",Annual Financial Information and Operating Data,https://emma.msrb.org/MarketActivity/ContinuingDisclosureDetails/P31079110,01/26/2021
ARIZONA INDL DEV AUTH ED REV,Annual Financial Information and Operating Data,https://emma.msrb.org/MarketActivity/ContinuingDisclosureDetails/P11112593,01/26/2021
ARIZONA INDUSTRIAL DEVELOPMENT AUTHORITY,Annual Financial Information and Operating Data,https://emma.msrb.org/MarketActivity/ContinuingDisclosureDetails/P11112593,01/26/2021
ASSOCIATION COUNTY COMMISSIONERS OF GEORGIA,Annual Financial Information and Operating Data,https://emma.msrb.org/MarketActivity/ContinuingDisclosureDetails/P31079073,01/26/2021
BELL CMNTY REDEV AGY CALIF TAX ALLOCATION,Annual Financial Information and Operating Data,https://emma.msrb.org/MarketActivity/ContinuingDisclosureDetails/P11112515,01/26/2021
BELLINGHAM MASS,Annual Financial Information and Operating Data,https://emma.msrb.org/MarketActivity/ContinuingDisclosureDetails/P31079086,01/26/2021
"BERKELEY (CITY OF), MISSOURI",Annual Financial Information and Operating Data,https://emma.msrb.org/MarketActivity/ContinuingDisclosureDetails/P31079121,01/26/2021
BERKELEY MO,Annual Financial Information and Operating Data,https://emma.msrb.org/MarketActivity/ContinuingDisclosureDetails/P31079121,01/26/2021
BLACKSTONE MASS,Annual Financial Information and Operating Data,https://emma.msrb.org/MarketActivity/ContinuingDisclosureDetails/P31079086,01/26/2021
BLACKSTONE VALLEY MASS VOCATIONAL REGL TECHNICAL SCH DIST,Annual Financial Information and Operating Data,https://emma.msrb.org/MarketActivity/ContinuingDisclosureDetails/P31079086,01/26/2021
"BLACKSTONE VALLEY REGIONAL VOCATIONAL TECHNICAL SCHOOL DISTRICT, MASSACHUSETTS",Annual Financial Information and Operating Data,https://emma.msrb.org/MarketActivity/ContinuingDisclosureDetails/P31079086,01/26/2021
"BOARD OF EDUCATION OF THE BOROUGH OF PAULSBORO, NEW JERSEY",Annual Financial Information and Operating Data,https://emma.msrb.org/MarketActivity/ContinuingDisclosureDetails/P31079311,01/26/2021
"BOARD OF EDUCATION OF THE BOROUGH OF SPOTSWOOD, IN THE COUNTY OF MIDDLESEX, NEW JERSEY",Annual Financial Information and Operating Data,https://emma.msrb.org/MarketActivity/ContinuingDisclosureDetails/P31079168,01/26/2021
"BOARD OF EDUCATION OF THE CLEARVIEW REGIONAL HIGH SCHOOL DISTRICT IN THE COUNTY OF GLOUCESTER, NEW JERSEY",Annual Financial Information and Operating Data,https://emma.msrb.org/MarketActivity/ContinuingDisclosureDetails/P11112253,01/26/2021
"BOARD OF EDUCATION OF THE TOWNSHIP OF CEDAR GROVE, NEW JERSEY",Annual Financial Information and Operating Data,https://emma.msrb.org/MarketActivity/ContinuingDisclosureDetails/P31079306,01/26/2021
BOARD OF TRUSTEES OF EASTERN ILLINOIS UNIVERSITY,Annual Financial Information and Operating Data,https://emma.msrb.org/MarketActivity/ContinuingDisclosureDetails/P11112165,01/26/2021
BOARD OF TRUSTEES OF WESTERN ILLINOIS UNIVERSITY,Annual Financial Information and Operating Data,https://emma.msrb.org/MarketActivity/ContinuingDisclosureDetails/P11112168,01/26/2021
"BOROUGH OF FOX CHAPEL ALLEGHENY COUNTY, PENNSYLVANIA",Annual Financial Information and Operating Data,https://emma.msrb.org/MarketActivity/ContinuingDisclosureDetails/P31079194,01/26/2021
BOURBON CNTY KY,Annual Financial Information and Operating Data,https://emma.msrb.org/MarketActivity/ContinuingDisclosureDetails/P11112507,01/26/2021
BRAZORIA CNTY TEX MUN UTIL DIST NO 16,Annual Financial Information and Operating Data,https://emma.msrb.org/MarketActivity/ContinuingDisclosureDetails/P11112307,01/26/2021
BRAZORIA COUNTY MUNICIPAL UTILITY DISTRICT NO. 16,Annual Financial Information and Operating Data,https://emma.msrb.org/MarketActivity/ContinuingDisclosureDetails/P11112307,01/26/2021
BRAZORIA COUNTY MUNICIPAL UTILITY DISTRICT NO. 16 (A POLITICAL SUBDIVISION OF THE STATE OF TEXAS,Annual Financial Information and Operating Data,https://emma.msrb.org/MarketActivity/ContinuingDisclosureDetails/P11112307,01/26/2021
"BRAZORIA COUNTY MUNICIPAL UTILITY DISTRICT NO. 16, TEXAS",Annual Financial Information and Operating Data,https://emma.msrb.org/MarketActivity/ContinuingDisclosureDetails/P11112307,01/26/2021
"BRAZORIA COUNTY MUNICIPAL UTILITY DISTRICT NO. 16, TEXAS (A POLITICAL SUBDIVISION OF THE STATE OF TEXAS LOCATED WITHIN BRAZORIA COUNTY)",Annual Financial Information and Operating Data,https://emma.msrb.org/MarketActivity/ContinuingDisclosureDetails/P11112307,01/26/2021
"BULLHEAD CITY FIRE DISTRICT, ARIZONA",Annual Financial Information and Operating Data,https://emma.msrb.org/MarketActivity/ContinuingDisclosureDetails/P31079315,01/26/2021
BUNCOMBE CNTY N C MET SEW DIST SEW SYS REV,Annual Financial Information and Operating Data,https://emma.msrb.org/MarketActivity/ContinuingDisclosureDetails/P31079085,01/26/2021
"BUREAU CO TOWNSHIP HIGH SCHOOL DISTRICT NO. 502, ILLINOIS (HALL)",Annual Financial Information and Operating Data,https://emma.msrb.org/MarketActivity/ContinuingDisclosureDetails/P31078904,01/26/2021
CALIFORNIA CNTY CALIF TOB SECURITIZATION AGY TOB SETTLEMENT REV,Annual Financial Information and Operating Data,https://emma.msrb.org/MarketActivity/ContinuingDisclosureDetails/P31079133,01/26/2021
CALIFORNIA COUNTY TOBACCO SECURITIZATION AGENCY,Annual Financial Information and Operating Data,https://emma.msrb.org/MarketActivity/ContinuingDisclosureDetails/P31079133,01/26/2021
CALIFORNIA MUNICIPAL FINANCE AUTHORITY,Annual Financial Information and Operating Data,https://emma.msrb.org/MarketActivity/ContinuingDisclosureDetails/P31079318,01/26/2021
CALIFORNIA SCHOOL FINANCE AUTHORITY,Annual Financial Information and Operating Data,https://emma.msrb.org/MarketActivity/ContinuingDisclosureDetails/P11112429,01/26/2021
CALIFORNIA STATEWIDE CMNTYS DEV AUTH WTR & WASTEWATER REV,Annual Financial Information and Operating Data,https://emma.msrb.org/MarketActivity/ContinuingDisclosureDetails/P11112504,01/26/2021
CALIFORNIA STATEWIDE CMNTYS DEV AUTH WTR & WASTEWATER REV,Annual Financial Information and Operating Data,https://emma.msrb.org/MarketActivity/ContinuingDisclosureDetails/P11112488,01/26/2021
CALIFORNIA STATEWIDE CMNTYS DEV AUTH WTR REV,Annual Financial Information and Operating Data,https://emma.msrb.org/MarketActivity/ContinuingDisclosureDetails/P11112600,01/26/2021
CALIFORNIA STATEWIDE COMMUNITIES DEVELOPMENT AUTHORITY WATER AND WASTEWATER REVENUE BONDS (TOWN OF WINDSOR AND WINDSOR WATER DISTRICT SERIES 2012D),Annual Financial Information and Operating Data,https://emma.msrb.org/MarketActivity/ContinuingDisclosureDetails/P11112518,01/26/2021
"CAMARILLO PUBLIC FINANCE AUTHORITY, CALIFORNIA",Annual Financial Information and Operating Data,https://emma.msrb.org/MarketActivity/ContinuingDisclosureDetails/P11112368,01/26/2021
"CAMARILLO PUBLIC FINANCE AUTHORITY, CALIFORNIA",Annual Financial Information and Operating Data,https://emma.msrb.org/MarketActivity/ContinuingDisclosureDetails/P11112388,01/26/2021
"CAMARILLO SANITARY DISTRICT, CALIFORNIA",Annual Financial Information and Operating Data,https://emma.msrb.org/MarketActivity/ContinuingDisclosureDetails/P11112377,01/26/2021
CARROLL COUNTY SCHOOL DISTRICT (GEORGIA),Annual Financial Information and Operating Data,https://emma.msrb.org/MarketActivity/ContinuingDisclosureDetails/P31079164,01/26/2021
CHULA VISTA MUNICIPAL FINANCING AUTHORITY,Annual Financial Information and Operating Data,https://emma.msrb.org/MarketActivity/ContinuingDisclosureDetails/P11112527,01/26/2021
CHULA VISTA MUNICIPAL FINANCING AUTHORITY,Annual Financial Information and Operating Data,https://emma.msrb.org/MarketActivity/ContinuingDisclosureDetails/P11112520,01/26/2021
CHULA VISTA MUNICIPAL FINANCING AUTHORITY,Annual Financial Information and Operating Data,https://emma.msrb.org/MarketActivity/ContinuingDisclosureDetails/P11112524,01/26/2021
"CITY OF BERKELEY, MISSOURI",Annual Financial Information and Operating Data,https://emma.msrb.org/MarketActivity/ContinuingDisclosureDetails/P31079121,01/26/2021
"CITY OF BERKELEY, MO",Annual Financial Information and Operating Data,https://emma.msrb.org/MarketActivity/ContinuingDisclosureDetails/P31079121,01/26/2021
"CITY OF CAMPBELLSVILLE, KENTUCKY",Annual Financial Information and Operating Data,https://emma.msrb.org/MarketActivity/ContinuingDisclosureDetails/P11112510,01/26/2021
"CITY OF CORALVILLE, IOWA",Annual Financial Information and Operating Data,https://emma.msrb.org/MarketActivity/ContinuingDisclosureDetails/P11112564,01/26/2021
"CITY OF CORALVILLE, IOWA (CORALVILLE MARRIOTT HOTEL AND CONVENTION CENTER)",Annual Financial Information and Operating Data,https://emma.msrb.org/MarketActivity/ContinuingDisclosureDetails/P11112564,01/26/2021
"CITY OF CRESTON, IOWA",Annual Financial Information and Operating Data,https://emma.msrb.org/MarketActivity/ContinuingDisclosureDetails/P11112419,01/26/2021
CITY OF DUBUQUE IOWA,Annual Financial Information and Operating Data,https://emma.msrb.org/MarketActivity/ContinuingDisclosureDetails/P11112433,01/26/2021
"CITY OF DUBUQUE, IA",Annual Financial Information and Operating Data,https://emma.msrb.org/MarketActivity/ContinuingDisclosureDetails/P11112433,01/26/2021
"CITY OF DUBUQUE, IOWA",Annual Financial Information and Operating Data,https://emma.msrb.org/MarketActivity/ContinuingDisclosureDetails/P11112433,01/26/2021
CITY OF DUBUQUE. IOWA,Annual Financial Information and Operating Data,https://emma.msrb.org/MarketActivity/ContinuingDisclosureDetails/P11112433,01/26/2021
"CITY OF FAYETTEVILLE, NORTH CAROLINA",Annual Financial Information and Operating Data,https://emma.msrb.org/MarketActivity/ContinuingDisclosureDetails/P11112223,01/26/2021
"CITY OF FAYETTEVILLE, NORTH CAROLINA",Annual Financial Information and Operating Data,https://emma.msrb.org/MarketActivity/ContinuingDisclosureDetails/P11112264,01/26/2021
"CITY OF FORT MADISON, IOWA",Annual Financial Information and Operating Data,https://emma.msrb.org/MarketActivity/ContinuingDisclosureDetails/P31079217,01/26/2021
"CITY OF GRASS VALLEY, NEVADA COUNTY, CA",Annual Financial Information and Operating Data,https://emma.msrb.org/MarketActivity/ContinuingDisclosureDetails/P11112456,01/26/2021
"CITY OF HUMBOLDT, IOWA",Annual Financial Information and Operating Data,https://emma.msrb.org/MarketActivity/ContinuingDisclosureDetails/P11112291,01/26/2021
"CITY OF LEITCHFIELD, KENTUCKY",Annual Financial Information and Operating Data,https://emma.msrb.org/MarketActivity/ContinuingDisclosureDetails/P11112491,01/26/2021
"CITY OF LEITCHFIELD, KENTUCKY",Annual Financial Information and Operating Data,https://emma.msrb.org/MarketActivity/ContinuingDisclosureDetails/P31079270,01/26/2021
"CITY OF MENASHA, WISCONSIN",Annual Financial Information and Operating Data,https://emma.msrb.org/MarketActivity/ContinuingDisclosureDetails/P31079240,01/26/2021
"CITY OF MURRAY, KENTUCKY",Annual Financial Information and Operating Data,https://emma.msrb.org/MarketActivity/ContinuingDisclosureDetails/P11112208,01/26/2021
"CITY OF NORTH LIBERTY, IOWA",Annual Financial Information and Operating Data,https://emma.msrb.org/MarketActivity/ContinuingDisclosureDetails/P31079325,01/26/2021
"CITY OF NORTH LIBERTY, IOWA",Annual Financial Information and Operating Data,https://emma.msrb.org/MarketActivity/ContinuingDisclosureDetails/P31079328,01/26/2021
"CITY OF NORTH LIBERTY, IOWA",Annual Financial Information and Operating Data,https://emma.msrb.org/MarketActivity/ContinuingDisclosureDetails/P31079327,01/26/2021
"CITY OF OAK RIDGE NORTH, TEXAS (A POLITICAL SUBDIVISION OF THE STATE OF TEXAS)",Annual Financial Information and Operating Data,https://emma.msrb.org/MarketActivity/ContinuingDisclosureDetails/P11112185,01/26/2021
"CITY OF OAK RIDGE NORTH, TEXAS (MONTGOMERY COUNTY, TEXAS)",Annual Financial Information and Operating Data,https://emma.msrb.org/MarketActivity/ContinuingDisclosureDetails/P11112185,01/26/2021
CITY OF PALMDALE,Annual Financial Information and Operating Data,https://emma.msrb.org/MarketActivity/ContinuingDisclosureDetails/P31078931,01/26/2021
"CITY OF PROVIDENCE, RHODE ISLAND",Annual Financial Information and Operating Data,https://emma.msrb.org/MarketActivity/ContinuingDisclosureDetails/P11112554,01/26/2021
CITY OF RIPON,Annual Financial Information and Operating Data,https://emma.msrb.org/MarketActivity/ContinuingDisclosureDetails/P11112600,01/26/2021
"CITY OF SALISBURY, NORTH CAROLINA",Annual Financial Information and Operating Data,https://emma.msrb.org/MarketActivity/ContinuingDisclosureDetails/P21091492,01/26/2021
CITY OF SANTA CLARITA COMMUNITY FACILITIES DISTRICT NUMBER 2016-1 (VISTA CANYON),Annual Financial Information and Operating Data,https://emma.msrb.org/MarketActivity/ContinuingDisclosureDetails/P11112565,01/26/2021
"CITY OF SIBLEY, IOWA",Annual Financial Information and Operating Data,https://emma.msrb.org/MarketActivity/ContinuingDisclosureDetails/P31079298,01/26/2021
CITY OF SOUTH SAN FRANCISCO PUBLIC FACILITIES FINANCING AUTHORITY (POLICE STATION PROJECT),Annual Financial Information and Operating Data,https://emma.msrb.org/MarketActivity/ContinuingDisclosureDetails/P11112490,01/26/2021
"CITY OF SPRINGFIELD, OREGON",Annual Financial Information and Operating Data,https://emma.msrb.org/MarketActivity/ContinuingDisclosureDetails/P11112352,01/26/2021
"CITY OF SURPRISE, ARIZONA",Annual Financial Information and Operating Data,https://emma.msrb.org/MarketActivity/ContinuingDisclosureDetails/P31079040,01/26/2021
"CITY OF SURPRISE, ARIZONA",Annual Financial Information and Operating Data,https://emma.msrb.org/MarketActivity/ContinuingDisclosureDetails/P31079054,01/26/2021
"CITY OF SURPRISE, ARIZONA",Annual Financial Information and Operating Data,https://emma.msrb.org/MarketActivity/ContinuingDisclosureDetails/P31079072,01/26/2021
"CLAREMONT UNIFIED SCHOOL DISTRICT (LOS ANGELES COUNTY, CALIFORNIA)",Annual Financial Information and Operating Data,https://emma.msrb.org/MarketActivity/ContinuingDisclosureDetails/P11112350,01/26/2021
COLORADO EDUCATIONAL AND CULTURAL FACILITIES AUTHORITY,Annual Financial Information and Operating Data,https://emma.msrb.org/MarketActivity/ContinuingDisclosureDetails/P11112494,01/26/2021
COLUMBIA BORO PA SCH DIST,Annual Financial Information and Operating Data,https://emma.msrb.org/MarketActivity/ContinuingDisclosureDetails/P31079126,01/26/2021
COLUMBIA BORO PA SCH DIST,Annual Financial Information and Operating Data,https://emma.msrb.org/MarketActivity/ContinuingDisclosureDetails/P31079139,01/26/2021
COLUMBIA BOROUGH SCHL DIST PENNSYLVANIA,Annual Financial Information and Operating Data,https://emma.msrb.org/MarketActivity/ContinuingDisclosureDetails/P31079126,01/26/2021
COLUMBIA BOROUGH SCHL DIST PENNSYLVANIA,Annual Financial Information and Operating Data,https://emma.msrb.org/MarketActivity/ContinuingDisclosureDetails/P31079139,01/26/2021
"COLUMBIA BOROUGH SCHOOL DISTRICT LANCASTER COUNTY, PENNSYLVANIA",Annual Financial Information and Operating Data,https://emma.msrb.org/MarketActivity/ContinuingDisclosureDetails/P31079126,01/26/2021
"COLUMBIA BOROUGH SCHOOL DISTRICT LANCASTER COUNTY, PENNSYLVANIA",Annual Financial Information and Operating Data,https://emma.msrb.org/MarketActivity/ContinuingDisclosureDetails/P31079139,01/26/2021
"COMMUNITY COLLEGE DISTRICT #503 COUNTIES OF ROCK ISLAND, HENRY, MERCER, WHITESIDE, HENDERSON, KNOW, BUREAU, STARK AND MARSHAL, ILLINOIS (BLACK HAWK COLLEGE)",Annual Financial Information and Operating Data,https://emma.msrb.org/MarketActivity/ContinuingDisclosureDetails/P11112379,01/26/2021
"COMMUNITY COLLEGE DISTRICT NO. 503, COUNTIES OF ROCK ISLAND, HENRY, MERCER, WHITESIDE, HENDERSON, KNOX, BUREAU, STARK AND MARSHALL AND STATE OF ILLINOIS (BLACK HAWK COLLEGE)",Annual Financial Information and Operating Data,https://emma.msrb.org/MarketActivity/ContinuingDisclosureDetails/P11112379,01/26/2021
"COMMUNITY COLLEGE DISTRICT NO. 512, COOK, KANE ET AL COS (WILLIAM RAINEY HARPER), ILLINOIS",Annual Financial Information and Operating Data,https://emma.msrb.org/MarketActivity/ContinuingDisclosureDetails/P11112482,01/26/2021
"COMMUNITY COLLEGE DISTRICT NO. 512, COOK, KANE, LAKE, AND MCHENRY, STATE OF ILLINOIS (WILLIAM RAINEY HARPER COLLEGE)",Annual Financial Information and Operating Data,https://emma.msrb.org/MarketActivity/ContinuingDisclosureDetails/P11112482,01/26/2021
"COMMUNITY COLLEGE DISTRICT NO. 524, COUNTY OF COOK AND STATE OF ILLINOIS (MORAINE VALLEY)",Annual Financial Information and Operating Data,https://emma.msrb.org/MarketActivity/ContinuingDisclosureDetails/P11112399,01/26/2021
"COMMUNITY COLLEGE DISTRICT NO. 530 COUNTIES OF WILLIAMSON, JACKSON, FRANKLIN, PERRY & RANDOLPH & STATE OF ILLINOIS (JOHN A. LOGAN)",Annual Financial Information and Operating Data,https://emma.msrb.org/MarketActivity/ContinuingDisclosureDetails/P31078867,01/26/2021
"COMMUNITY COLLEGE DISTRICT NO. 530, COUNTIES OF WILLIAMSON, JACKSON, FRANKLIN, PERRY AND RANDOLPH AND STATE OF ILLINOIS (JOHN A. LOGAN)",Annual Financial Information and Operating Data,https://emma.msrb.org/MarketActivity/ContinuingDisclosureDetails/P31078867,01/26/2021
"COMMUNITY COLLEGE DISTRICT NO. 533, COUNTIES OF WHITE, GALLATIN, SALINE, HARDIN, POPE, JOHNSON, WILLIAMSON AND HAMILTON AND STATE OF ILLINOIS (SOUTHEASTERN ILLINOIS)",Annual Financial Information and Operating Data,https://emma.msrb.org/MarketActivity/ContinuingDisclosureDetails/P11112296,01/26/2021
"COMMUNITY COLLEGE DISTRICT NO. 533, COUNTIES OF WHITE, GALLATIN, SALINE, HARDIN, POPE, JOHNSON, WILLIAMSON, AND HAMILTON AND STATE OF ILLINOIS (SOUTHEASTERN ILLINOIS)",Annual Financial Information and Operating Data,https://emma.msrb.org/MarketActivity/ContinuingDisclosureDetails/P11112296,01/26/2021
"COMMUNITY COLLEGE DISTRICT NO.524, COUNTY OF COOK AND STATE OF ILLINOIS (MORAINE VALLEY)",Annual Financial Information and Operating Data,https://emma.msrb.org/MarketActivity/ContinuingDisclosureDetails/P11112399,01/26/2021
"COMMUNITY COLLEGE DISTRICT NUMBER 522 COUNTIES OF ST. CLAIR, MADISON, MONROE, RANDOLPH, WASHINGTON, BOND, PERRY AND MONTGOMERY, ILLINOIS (SOUTHWESTERN ILLINOIS COLLEGE)",Annual Financial Information and Operating Data,https://emma.msrb.org/MarketActivity/ContinuingDisclosureDetails/P11112302,01/26/2021
"COMMUNITY CONSOLIDATED SCHOOL DISTRICT NO. 102 LAKE COUNTY (APTAKISIC-TRIPP), ILLINOIS",Annual Financial Information and Operating Data,https://emma.msrb.org/MarketActivity/ContinuingDisclosureDetails/P31079176,01/26/2021
"COMMUNITY CONSOLIDATED SCHOOL DISTRICT NO. 102 OF LAKE COUNTY (APTAKISIC-TRIPP), ILLINOIS",Annual Financial Information and Operating Data,https://emma.msrb.org/MarketActivity/ContinuingDisclosureDetails/P31079176,01/26/2021
"COMMUNITY CONSOLIDATED SCHOOL DISTRICT NO. 65 (EVANSTON/SKOKIE), ILLINOIS",Annual Financial Information and Operating Data,https://emma.msrb.org/MarketActivity/ContinuingDisclosureDetails/P11112150,01/26/2021
"COMMUNITY CONSOLIDATED SCHOOL DISTRICT NUMBER 102 LAKE COUNTY, ILLINOIS (APTAKISIC-TRIPP)",Annual Financial Information and Operating Data,https://emma.msrb.org/MarketActivity/ContinuingDisclosureDetails/P31079176,01/26/2021
"COMMUNITY CONSOLIDATED SCHOOL DISTRICT NUMBER 62 (DES PLAINES), COOK COUNTY, ILLINOIS",Annual Financial Information and Operating Data,https://emma.msrb.org/MarketActivity/ContinuingDisclosureDetails/P11112148,01/26/2021
"COMMUNITY CONSOLIDATED SCHOOL DISTRICT NUMBER 64 COOK COUNTY, ILLINOIS (PARK RIDGE–NILES)",Annual Financial Information and Operating Data,https://emma.msrb.org/MarketActivity/ContinuingDisclosureDetails/P11112149,01/26/2021
"COMMUNITY CONSOLIDATED SCHOOL DISTRICT NUMBER 65 COOK COUNTY, ILLINOIS",Annual Financial Information and Operating Data,https://emma.msrb.org/MarketActivity/ContinuingDisclosureDetails/P11112150,01/26/2021
"COMMUNITY CONSOLIDATED SCHOOL DISTRICT NUMBER 65 (EVANSTON/SKOKIE) COOK COUNTY, ILLINOIS",Annual Financial Information and Operating Data,https://emma.msrb.org/MarketActivity/ContinuingDisclosureDetails/P11112150,01/26/2021
COMMUNITY CONSOLIDATED SCHOOL DISTRICT NUMBER 65 EVANSTON/SKOKIE IL,Annual Financial Information and Operating Data,https://emma.msrb.org/MarketActivity/ContinuingDisclosureDetails/P11112150,01/26/2021
"COMMUNITY CONSOLIDATED SCHOOL DISTRICT NUMBER 65, COOK COUNTY, ILLINOIS.",Annual Financial Information and Operating Data,https://emma.msrb.org/MarketActivity/ContinuingDisclosureDetails/P11112150,01/26/2021
COMMUNITY FACILITIES DISTRICT NUMBER 2018-1 COACHELLA (OF THE CITY OF) (GLENROY),Annual Financial Information and Operating Data,https://emma.msrb.org/MarketActivity/ContinuingDisclosureDetails/P11112540,01/26/2021
COMMUNITY HIGH SCHOOL DISTRICT NUMBER 218,Annual Financial Information and Operating Data,https://emma.msrb.org/MarketActivity/ContinuingDisclosureDetails/P11112409,01/26/2021
"COMMUNITY HIGH SCHOOL DISTRICT NUMBER 218 COOK COUNTY, ILLINOIS (OAK LAWN)",Annual Financial Information and Operating Data,https://emma.msrb.org/MarketActivity/ContinuingDisclosureDetails/P11112409,01/26/2021
"COMMUNITY HIGH SCHOOL DISTRICT NUMBER 218, COOK COUNTY, ILLINOIS (OAK LAWN)",Annual Financial Information and Operating Data,https://emma.msrb.org/MarketActivity/ContinuingDisclosureDetails/P11112409,01/26/2021
"COMMUNITY HIGH SCHOOL DISTRICT NUMBER 219, COOK COUNTY, ILLINOIS (NILES TOWNSHIP)",Annual Financial Information and Operating Data,https://emma.msrb.org/MarketActivity/ContinuingDisclosureDetails/P31079015,01/26/2021
"COMMUNITY UNIT SCHOOL DISTRICT NUMBER 187, LAKE COUNTY, ILLINOIS",Annual Financial Information and Operating Data,https://emma.msrb.org/MarketActivity/ContinuingDisclosureDetails/P11112221,01/26/2021
COMMUNITY UNIT SCHOOL DISTRICT NUMBER 300 (CARPENTERSVILLE),Annual Financial Information and Operating Data,https://emma.msrb.org/MarketActivity/ContinuingDisclosureDetails/P11112154,01/26/2021
"COMMUNITY UNIT SCHOOL DISTRICT NUMBER 300 KANE, MCHENRY, COOK AND DEKALB COUNTIES, ILLINOIS",Annual Financial Information and Operating Data,https://emma.msrb.org/MarketActivity/ContinuingDisclosureDetails/P11112154,01/26/2021
"COMMUNITY UNIT SCHOOL DISTRICT NUMBER 300 KANE, MCHENRY, COOK AND DEKALB COUNTIES, ILLINOIS (CARPENTERSVILLE)",Annual Financial Information and Operating Data,https://emma.msrb.org/MarketActivity/ContinuingDisclosureDetails/P11112154,01/26/2021
"COMMUNITY UNIT SCHOOL DISTRICT NUMBER 300, KANE, MCHENRY, COOK AND DEKALB COUNTIES, ILLINOIS",Annual Financial Information and Operating Data,https://emma.msrb.org/MarketActivity/ContinuingDisclosureDetails/P11112154,01/26/2021
"COMMUNITY UNIT SCHOOL DISTRICT NUMBER 304 KANE COUNTY, ILLINOIS",Annual Financial Information and Operating Data,https://emma.msrb.org/MarketActivity/ContinuingDisclosureDetails/P11112361,01/26/2021
CONCHO VALLEY TEX HSG FIN CORP SINGLE FAMILY REV,Annual Financial Information and Operating Data,https://emma.msrb.org/MarketActivity/ContinuingDisclosureDetails/P11112453,01/26/2021
CONROE MUNICIPAL MANAGEMENT DISTRICT NO. 1 TEXAS,Annual Financial Information and Operating Data,https://emma.msrb.org/MarketActivity/ContinuingDisclosureDetails/P31078852,01/26/2021
"CONROE MUNICIPAL MANAGEMENT DISTRICT NO. 1, TEXAS",Annual Financial Information and Operating Data,https://emma.msrb.org/MarketActivity/ContinuingDisclosureDetails/P31078852,01/26/2021
CONROE TEX MUN MGMT DIST NO 1,Annual Financial Information and Operating Data,https://emma.msrb.org/MarketActivity/ContinuingDisclosureDetails/P31078852,01/26/2021
"CONSOLIDATED HIGH SCHOOL DISTRICT NUMBER 120 LAKE COUNTY, ILLINOIS (MUNDELEIN)",Annual Financial Information and Operating Data,https://emma.msrb.org/MarketActivity/ContinuingDisclosureDetails/P31078932,01/26/2021
COOK CNTY ILL CMNTY COLLEGE DIST NO 524 MORAINE VY,Annual Financial Information and Operating Data,https://emma.msrb.org/MarketActivity/ContinuingDisclosureDetails/P11112399,01/26/2021
