issuer_name,disclosure_desc,link,date_posted
KENTUCKY BD CORP FING PROG REV,Annual Financial Information and Operating Data,https://emma.msrb.org/MarketActivity/ContinuingDisclosureDetails/P11112342,01/26/2021
KENTUCKY BOND COPORATION,Annual Financial Information and Operating Data,https://emma.msrb.org/MarketActivity/ContinuingDisclosureDetails/P11112337,01/26/2021
KENTUCKY BOND COPORATION,Annual Financial Information and Operating Data,https://emma.msrb.org/MarketActivity/ContinuingDisclosureDetails/P11112342,01/26/2021
KENTUCKY BOND CORPORATION,Annual Financial Information and Operating Data,https://emma.msrb.org/MarketActivity/ContinuingDisclosureDetails/P11112337,01/26/2021
KENTUCKY BOND CORPORATION,Annual Financial Information and Operating Data,https://emma.msrb.org/MarketActivity/ContinuingDisclosureDetails/P11112342,01/26/2021
"KENTUCKY BOND CORPORATION, KENTUCKY",Annual Financial Information and Operating Data,https://emma.msrb.org/MarketActivity/ContinuingDisclosureDetails/P11112337,01/26/2021
"KENTUCKY BOND CORPORATION, KENTUCKY",Annual Financial Information and Operating Data,https://emma.msrb.org/MarketActivity/ContinuingDisclosureDetails/P11112342,01/26/2021
LA HABRA CALIF CITY SCH DIST,Annual Financial Information and Operating Data,https://emma.msrb.org/MarketActivity/ContinuingDisclosureDetails/P11112592,01/26/2021
"LA HABRA CITY SCHOOL DISTRICT (ORANGE COUNTY, CALIFORNIA)",Annual Financial Information and Operating Data,https://emma.msrb.org/MarketActivity/ContinuingDisclosureDetails/P11112592,01/26/2021
"LA HABRA CITY SCHOOL DISTRICT, CALIFORNIA",Annual Financial Information and Operating Data,https://emma.msrb.org/MarketActivity/ContinuingDisclosureDetails/P11112592,01/26/2021
LA SALLE CNTY ILL SCH DIST NO 124,Annual Financial Information and Operating Data,https://emma.msrb.org/MarketActivity/ContinuingDisclosureDetails/P11112326,01/26/2021
LAKE CNTY ILL CMNTY UNIT SCH DIST NO 187 NORTH CHICAGO,Annual Financial Information and Operating Data,https://emma.msrb.org/MarketActivity/ContinuingDisclosureDetails/P11112221,01/26/2021
LAKE CNTY ILL CONS HIGH SCH DIST NO 120 MUNDELEIN,Annual Financial Information and Operating Data,https://emma.msrb.org/MarketActivity/ContinuingDisclosureDetails/P31078932,01/26/2021
LAKE CNTY ILL SCH DIST NO 006 ZION,Annual Financial Information and Operating Data,https://emma.msrb.org/MarketActivity/ContinuingDisclosureDetails/P11112411,01/26/2021
LAKE CNTY ILL SCH DIST NO 103 LINCOLNSHIRE-PRAIRIE VIEW,Annual Financial Information and Operating Data,https://emma.msrb.org/MarketActivity/ContinuingDisclosureDetails/P31079174,01/26/2021
"LAKE COUNTY SCHOOL DISTRICT NO. 103 (LINCOLNSHIRE-PRAIRIE VIEW), ILLINOIS",Annual Financial Information and Operating Data,https://emma.msrb.org/MarketActivity/ContinuingDisclosureDetails/P31079174,01/26/2021
LAKE MUNICIPAL UTILITY DISTRICT TEXAS,Annual Financial Information and Operating Data,https://emma.msrb.org/MarketActivity/ContinuingDisclosureDetails/P31078958,01/26/2021
"LAKE MUNICIPAL UTILITY DISTRICT, TEXAS",Annual Financial Information and Operating Data,https://emma.msrb.org/MarketActivity/ContinuingDisclosureDetails/P31078958,01/26/2021
LAKEWOOD MICH PUB SCHS,Annual Financial Information and Operating Data,https://emma.msrb.org/MarketActivity/ContinuingDisclosureDetails/P11096870,01/26/2021
"LAKEWOOD PUBLIC SCHOOLS COUNTIES OF IONIA, BARRY, EATON AND KENT, STATE OF MICHIGAN",Annual Financial Information and Operating Data,https://emma.msrb.org/MarketActivity/ContinuingDisclosureDetails/P11096870,01/26/2021
"LAKEWOOD PUBLIC SCHOOLS, COUNTIES OF IONIA, BARRY, EATON AND KENT, STATE OF MICHIGAN",Annual Financial Information and Operating Data,https://emma.msrb.org/MarketActivity/ContinuingDisclosureDetails/P11096870,01/26/2021
LANCASTER EDL ASSISTANCE PROGRAM INC. SOUTH CAROLINA INSTALLMENT PUR REV,Annual Financial Information and Operating Data,https://emma.msrb.org/MarketActivity/ContinuingDisclosureDetails/P11112349,01/26/2021
"LANCASTER EDUCATION ASSISTANCE PROGRAM, INC.",Annual Financial Information and Operating Data,https://emma.msrb.org/MarketActivity/ContinuingDisclosureDetails/P11112349,01/26/2021
LANE CNTY ORE MET WASTEWATER MGMT COMMN REV,Annual Financial Information and Operating Data,https://emma.msrb.org/MarketActivity/ContinuingDisclosureDetails/P11112314,01/26/2021
"LASALLE AND BUREAU COUNTIES TOWNSHIP HIGH SCHOOL DISTRICT NO. 120, ILLINOIS",Annual Financial Information and Operating Data,https://emma.msrb.org/MarketActivity/ContinuingDisclosureDetails/P11112320,01/26/2021
"LASALLE AND BUREAU COUNTIES TOWNSHIP HIGH SCHOOL DISTRICT NO. 120, ILLINOIS (LASALLE-PERU)",Annual Financial Information and Operating Data,https://emma.msrb.org/MarketActivity/ContinuingDisclosureDetails/P11112320,01/26/2021
"LASALLE COUNTY COMMUNITY CONSOLIDATED SCHOOL DISTRICT NO. 195, ILLINOIS",Annual Financial Information and Operating Data,https://emma.msrb.org/MarketActivity/ContinuingDisclosureDetails/P31078921,01/26/2021
LASALLE COUNTY ELEMENTARY SCHOOL DISTRICT NO. 124 ILLINOIS (PERU),Annual Financial Information and Operating Data,https://emma.msrb.org/MarketActivity/ContinuingDisclosureDetails/P11112326,01/26/2021
"LASALLE COUNTY ELEMENTARY SCHOOL DISTRICT NO. 124, ILLINOIS (PERU)",Annual Financial Information and Operating Data,https://emma.msrb.org/MarketActivity/ContinuingDisclosureDetails/P11112326,01/26/2021
"LASALLE-PERU TOWNSHIP HIGH SCHOOL DISTRICT NUMBER 120, ILLINOIS LASALLE AND BUREAU COUNTIES",Annual Financial Information and Operating Data,https://emma.msrb.org/MarketActivity/ContinuingDisclosureDetails/P11112320,01/26/2021
"LASALLE-PERU TOWNSHIP HIGH SCHOOL DISTRICT NUMBER 120, LASALLE AND BUREAU COUNTIES, ILLINOIS",Annual Financial Information and Operating Data,https://emma.msrb.org/MarketActivity/ContinuingDisclosureDetails/P11112320,01/26/2021
LAURENS EDUCATION ASSISTANCE FOR DISTRICT NO. 55,Annual Financial Information and Operating Data,https://emma.msrb.org/MarketActivity/ContinuingDisclosureDetails/P31079294,01/26/2021
LEITCHFIELD KY,Annual Financial Information and Operating Data,https://emma.msrb.org/MarketActivity/ContinuingDisclosureDetails/P31079270,01/26/2021
LENNOX CALIF SCH DIST,Annual Financial Information and Operating Data,https://emma.msrb.org/MarketActivity/ContinuingDisclosureDetails/P31079083,01/26/2021
LENNOX CALIF SCH DIST,Annual Financial Information and Operating Data,https://emma.msrb.org/MarketActivity/ContinuingDisclosureDetails/P31079099,01/26/2021
"LENNOX SCHOOL DISTRICT (LOS ANGELES COUNTY, CALIFORNIA)",Annual Financial Information and Operating Data,https://emma.msrb.org/MarketActivity/ContinuingDisclosureDetails/P31079083,01/26/2021
"LENNOX SCHOOL DISTRICT (LOS ANGELES COUNTY, CALIFORNIA)",Annual Financial Information and Operating Data,https://emma.msrb.org/MarketActivity/ContinuingDisclosureDetails/P31079099,01/26/2021
"LENNOX SCHOOL DISTRICT (LOS ANGELES COUNTY, CALIFORNIA)",Annual Financial Information and Operating Data,https://emma.msrb.org/MarketActivity/ContinuingDisclosureDetails/P31079083,01/26/2021
"LENNOX SCHOOL DISTRICT (LOS ANGELES COUNTY, CALIFORNIA)",Annual Financial Information and Operating Data,https://emma.msrb.org/MarketActivity/ContinuingDisclosureDetails/P31079099,01/26/2021
LINCOLN CNTY KY,Annual Financial Information and Operating Data,https://emma.msrb.org/MarketActivity/ContinuingDisclosureDetails/P11112525,01/26/2021
LINCOLN CNTY KY PUB PPTY CORP REV,Annual Financial Information and Operating Data,https://emma.msrb.org/MarketActivity/ContinuingDisclosureDetails/P11112525,01/26/2021
"LINCOLN COUNTY, KENTUCKY",Annual Financial Information and Operating Data,https://emma.msrb.org/MarketActivity/ContinuingDisclosureDetails/P11112525,01/26/2021
"LINCOLN COUNTY, KENTUCKY JUSTICE CENTER CORPORATION",Annual Financial Information and Operating Data,https://emma.msrb.org/MarketActivity/ContinuingDisclosureDetails/P11112525,01/26/2021
"LINCOLNSHIRE- PRAIRIE VIEW SCHOOL DISTRICT NO. 103, ILLINOIS",Annual Financial Information and Operating Data,https://emma.msrb.org/MarketActivity/ContinuingDisclosureDetails/P31079174,01/26/2021
"LONG COUNTY SCHOOL DISTRICT, GEORGIA",Annual Financial Information and Operating Data,https://emma.msrb.org/MarketActivity/ContinuingDisclosureDetails/P11112402,01/26/2021
LOOMIS CA,Annual Financial Information and Operating Data,https://emma.msrb.org/MarketActivity/ContinuingDisclosureDetails/P31078964,01/26/2021
LOUISIANA LOCAL GOVERNMENT ENVIRONMENTAL FACILITIES AND COMMUNITY DEVELOPMENT AUTHORITY,Annual Financial Information and Operating Data,https://emma.msrb.org/MarketActivity/ContinuingDisclosureDetails/P31078896,01/26/2021
LOUISIANA LOCAL GOVERNMENT ENVIRONMENTAL FACILITIES AND COMMUNITY DEVELOPMENT AUTHORITY,Annual Financial Information and Operating Data,https://emma.msrb.org/MarketActivity/ContinuingDisclosureDetails/P31078906,01/26/2021
LOUISIANA PUBLIC TRUST FINANCING AUTHORITY,Annual Financial Information and Operating Data,https://emma.msrb.org/MarketActivity/ContinuingDisclosureDetails/P31078896,01/26/2021
LOUISIANA PUBLIC TRUST FINANCING AUTHORITY,Annual Financial Information and Operating Data,https://emma.msrb.org/MarketActivity/ContinuingDisclosureDetails/P31078906,01/26/2021
"MACON COUNTY, ILLINOIS DECATUR SCHOOL DISTRICT NUMBER 61",Annual Financial Information and Operating Data,https://emma.msrb.org/MarketActivity/ContinuingDisclosureDetails/P11112413,01/26/2021
"MACON COUNTY, ILLINOIS, DECATUR SCHOOL DISTRICT NO. 61",Annual Financial Information and Operating Data,https://emma.msrb.org/MarketActivity/ContinuingDisclosureDetails/P11112413,01/26/2021
MAINE HEALTH AND HIGHER EDUCATIONAL FACILITIES AUTHORITY,Annual Financial Information and Operating Data,https://emma.msrb.org/MarketActivity/ContinuingDisclosureDetails/P31078982,01/26/2021
MARICOPA COUNTY SPECIAL HEALTH CARE DISTRICT,Annual Financial Information and Operating Data,https://emma.msrb.org/MarketActivity/ContinuingDisclosureDetails/P31079087,01/26/2021
MARLEY PARK CMNTY FACS DIST ARIZ,Annual Financial Information and Operating Data,https://emma.msrb.org/MarketActivity/ContinuingDisclosureDetails/P31079009,01/26/2021
"MARLEY PARK COMMUNITY FACILITIES DISTRICT (SURPRISE, ARIZONA)",Annual Financial Information and Operating Data,https://emma.msrb.org/MarketActivity/ContinuingDisclosureDetails/P31079009,01/26/2021
"MARSHALL COUNTY PUBLIC LIBRARY, KENTUCKY",Annual Financial Information and Operating Data,https://emma.msrb.org/MarketActivity/ContinuingDisclosureDetails/P11112528,01/26/2021
"MARSHALL COUNTY, ILLINOIS, MIDLAND COMMUNITY UNIT SCHOOL DISTRICT #7",Annual Financial Information and Operating Data,https://emma.msrb.org/MarketActivity/ContinuingDisclosureDetails/P31078973,01/26/2021
MENDON MASS,Annual Financial Information and Operating Data,https://emma.msrb.org/MarketActivity/ContinuingDisclosureDetails/P31079086,01/26/2021
"MENDOTA TOWNSHIP HIGH SCHOOL DISTRICT NUMBER 280, LASALLE, BUREAU AND LEE COUNTIES, ILLINOIS",Annual Financial Information and Operating Data,https://emma.msrb.org/MarketActivity/ContinuingDisclosureDetails/P31078890,01/26/2021
"METROPOLITAN SEWERAGE DISTRICT OF BUNCOMBE COUNTY, NORTH CAROLINA",Annual Financial Information and Operating Data,https://emma.msrb.org/MarketActivity/ContinuingDisclosureDetails/P31079085,01/26/2021
MIDPENINSULA REGIONAL OPEN SPACE DISTRICT,Annual Financial Information and Operating Data,https://emma.msrb.org/MarketActivity/ContinuingDisclosureDetails/P11112471,01/26/2021
MIDPENINSULA REGIONAL OPEN SPACE DISTRICT,Annual Financial Information and Operating Data,https://emma.msrb.org/MarketActivity/ContinuingDisclosureDetails/P11112471,01/26/2021
"MIDPENINSULA REGIONAL OPEN SPACE DISTRICT (COUNTIES OF SANTA CLARA, SAN MATEO AND SANTA CRUZ, CALIFORNIA)",Annual Financial Information and Operating Data,https://emma.msrb.org/MarketActivity/ContinuingDisclosureDetails/P11112467,01/26/2021
"MIDPENINSULA REGIONAL OPEN SPACE DISTRICT (COUNTIES OF SANTA CLARA, SAN MATEO AND SANTA CRUZ, CALIFORNIA)",Annual Financial Information and Operating Data,https://emma.msrb.org/MarketActivity/ContinuingDisclosureDetails/P11112472,01/26/2021
"MIDPENINSULA REGIONAL OPEN SPACE DISTRICT (COUNTIES OF SANTA CLARA, SAN MATEO AND SANTA CRUZ, CALIFORNIA)",Annual Financial Information and Operating Data,https://emma.msrb.org/MarketActivity/ContinuingDisclosureDetails/P11112462,01/26/2021
"MIDPENINSULA REGIONAL OPEN SPACE DISTRICT, CA",Annual Financial Information and Operating Data,https://emma.msrb.org/MarketActivity/ContinuingDisclosureDetails/P11112473,01/26/2021
MILFORD MASS,Annual Financial Information and Operating Data,https://emma.msrb.org/MarketActivity/ContinuingDisclosureDetails/P31079086,01/26/2021
MILLBURY MASS,Annual Financial Information and Operating Data,https://emma.msrb.org/MarketActivity/ContinuingDisclosureDetails/P31079086,01/26/2021
MODESTO CALIF ELEM SCH DIST STANISLAUS CNTY,Annual Financial Information and Operating Data,https://emma.msrb.org/MarketActivity/ContinuingDisclosureDetails/P11112499,01/26/2021
MODESTO CALIF ELEM SCH DIST STANISLAUS CNTY,Annual Financial Information and Operating Data,https://emma.msrb.org/MarketActivity/ContinuingDisclosureDetails/P11112500,01/26/2021
MODESTO CALIF HIGH SCH DIST STANISLAUS CNTY,Annual Financial Information and Operating Data,https://emma.msrb.org/MarketActivity/ContinuingDisclosureDetails/P11112499,01/26/2021
MODESTO CALIF HIGH SCH DIST STANISLAUS CNTY,Annual Financial Information and Operating Data,https://emma.msrb.org/MarketActivity/ContinuingDisclosureDetails/P11112500,01/26/2021
"MODESTO CITY ELEMENTARY SCHOOL DISTRICT (STANISLAUS COUNTY, CALIFORNIA)",Annual Financial Information and Operating Data,https://emma.msrb.org/MarketActivity/ContinuingDisclosureDetails/P11112499,01/26/2021
"MODESTO CITY ELEMENTARY SCHOOL DISTRICT (STANISLAUS COUNTY, CALIFORNIA)",Annual Financial Information and Operating Data,https://emma.msrb.org/MarketActivity/ContinuingDisclosureDetails/P11112500,01/26/2021
MODSETO CITY SCHOOLS JOINT POWERS AUTHORITY,Annual Financial Information and Operating Data,https://emma.msrb.org/MarketActivity/ContinuingDisclosureDetails/P11112499,01/26/2021
MODSETO CITY SCHOOLS JOINT POWERS AUTHORITY,Annual Financial Information and Operating Data,https://emma.msrb.org/MarketActivity/ContinuingDisclosureDetails/P11112500,01/26/2021
MONROE & ST CLAIR CNTYS ILL CMNTY UNIT SCH DIST NO 005,Annual Financial Information and Operating Data,https://emma.msrb.org/MarketActivity/ContinuingDisclosureDetails/P11112386,01/26/2021
"MONROE & ST. CLAIR COUNTIES, ILLINOIS WATERLOO UNIT COMMUNITY SCHOOL DISTRICT #5",Annual Financial Information and Operating Data,https://emma.msrb.org/MarketActivity/ContinuingDisclosureDetails/P11112386,01/26/2021
MONTANA FACILITY FINANCE AUTHORITY,Annual Financial Information and Operating Data,https://emma.msrb.org/MarketActivity/ContinuingDisclosureDetails/P31079195,01/26/2021
MURRAY KY,Annual Financial Information and Operating Data,https://emma.msrb.org/MarketActivity/ContinuingDisclosureDetails/P11112208,01/26/2021
NEW HAMPSHIRE HEALTH AND EDUCATION FACILITIES AUTHORITY,Annual Financial Information and Operating Data,https://emma.msrb.org/MarketActivity/ContinuingDisclosureDetails/P31078969,01/26/2021
"NEWBURG R-II SCHOOL DISTRICT OF PHELPS COUNTY, MISSOURI",Annual Financial Information and Operating Data,https://emma.msrb.org/MarketActivity/ContinuingDisclosureDetails/P11112449,01/26/2021
NORCO CALIF REDEV AGY TAX ALLOCATION,Annual Financial Information and Operating Data,https://emma.msrb.org/MarketActivity/ContinuingDisclosureDetails/P11112505,01/26/2021
"NORFOLK COUNTY, MASSACHUSETTS",Annual Financial Information and Operating Data,https://emma.msrb.org/MarketActivity/ContinuingDisclosureDetails/P31079082,01/26/2021
NORTH CAROLINA CENT UNIV REV,Annual Financial Information and Operating Data,https://emma.msrb.org/MarketActivity/ContinuingDisclosureDetails/P31079307,01/26/2021
NORTH CAROLINA CENTRAL UNIVERSITY,Annual Financial Information and Operating Data,https://emma.msrb.org/MarketActivity/ContinuingDisclosureDetails/P31079307,01/26/2021
NORTH CAROLINA CENTRAL UNIVERSITY OF THE BOARD OF GOVERNORS OF THE UNIVERSITY OF NORTH CAROLINA,Annual Financial Information and Operating Data,https://emma.msrb.org/MarketActivity/ContinuingDisclosureDetails/P31079307,01/26/2021
NORTH CAROLINA EASTERN MUNICIPAL POWER AGENCY,Annual Financial Information and Operating Data,https://emma.msrb.org/MarketActivity/ContinuingDisclosureDetails/P11112180,01/26/2021
NORTH CAROLINA EASTN MUN PWR AGY PWR SYS REV,Annual Financial Information and Operating Data,https://emma.msrb.org/MarketActivity/ContinuingDisclosureDetails/P11112179,01/26/2021
NORTH CAROLINA MUN PWR AGY NO 1 CATAWBA ELEC REV,Annual Financial Information and Operating Data,https://emma.msrb.org/MarketActivity/ContinuingDisclosureDetails/P11112166,01/26/2021
NORTH CAROLINA MUNI POWER AGENCY NUMBER 1,Annual Financial Information and Operating Data,https://emma.msrb.org/MarketActivity/ContinuingDisclosureDetails/P11112166,01/26/2021
NORTH CAROLINA MUNICIPAL POWER AGENCY NUMBER 1,Annual Financial Information and Operating Data,https://emma.msrb.org/MarketActivity/ContinuingDisclosureDetails/P11112166,01/26/2021
NORTH LIBERTY IOWA SWR REV,Annual Financial Information and Operating Data,https://emma.msrb.org/MarketActivity/ContinuingDisclosureDetails/P31079328,01/26/2021
NORTHBRIDGE MASS,Annual Financial Information and Operating Data,https://emma.msrb.org/MarketActivity/ContinuingDisclosureDetails/P31079086,01/26/2021
NORTHEAST IOWA COMMUNITY COLLEGE,Annual Financial Information and Operating Data,https://emma.msrb.org/MarketActivity/ContinuingDisclosureDetails/P11112396,01/26/2021
"NORTHEAST IOWA COMMUNITY COLLEGE (MERGED AREA I), IOWA",Annual Financial Information and Operating Data,https://emma.msrb.org/MarketActivity/ContinuingDisclosureDetails/P11112396,01/26/2021
"NORTHEAST IOWA COMMUNITY COLLEGE, IOWA (MERGED AREA I)",Annual Financial Information and Operating Data,https://emma.msrb.org/MarketActivity/ContinuingDisclosureDetails/P11112396,01/26/2021
"NORTHEAST IOWA COMMUNITY COLLEGE, STATE OF IOWA (MERGED AREA I)",Annual Financial Information and Operating Data,https://emma.msrb.org/MarketActivity/ContinuingDisclosureDetails/P11112396,01/26/2021
NORTHERN CALIFORNIA POWER AGENCY,Annual Financial Information and Operating Data,https://emma.msrb.org/MarketActivity/ContinuingDisclosureDetails/P31078924,01/26/2021
NORTHWEST CENT TEX HSG FIN CORP SINGLE FAMILY MTG REV,Annual Financial Information and Operating Data,https://emma.msrb.org/MarketActivity/ContinuingDisclosureDetails/P11112475,01/26/2021
"OAK LAWN-HOMETOWN, (COOK COUNTY) IL SCHOOL DISTRICT NUMBER 123",Annual Financial Information and Operating Data,https://emma.msrb.org/MarketActivity/ContinuingDisclosureDetails/P31078700,01/26/2021
OHIO CNTY KY WTR DIST WTRWKS REV,Annual Financial Information and Operating Data,https://emma.msrb.org/MarketActivity/ContinuingDisclosureDetails/P11112261,01/26/2021
OKLAHOMA HOUSING FINANCE AGENCY,Annual Financial Information and Operating Data,https://emma.msrb.org/MarketActivity/ContinuingDisclosureDetails/P31079317,01/26/2021
OKLAHOMA HSG FIN AGY SINGLE FAMILY MTG REV,Annual Financial Information and Operating Data,https://emma.msrb.org/MarketActivity/ContinuingDisclosureDetails/P31079317,01/26/2021
OKLAHOMA HSG FIN AGY SINGLE FAMILY REV,Annual Financial Information and Operating Data,https://emma.msrb.org/MarketActivity/ContinuingDisclosureDetails/P31079317,01/26/2021
OKLAHOMA WATER RESOURCES BOARD,Annual Financial Information and Operating Data,https://emma.msrb.org/MarketActivity/ContinuingDisclosureDetails/P11106243,01/26/2021
OREGON SCH BRDS ASSN,Annual Financial Information and Operating Data,https://emma.msrb.org/MarketActivity/ContinuingDisclosureDetails/P31079152,01/26/2021
OREGON SCHOOL BOARDS ASSOCIATION,Annual Financial Information and Operating Data,https://emma.msrb.org/MarketActivity/ContinuingDisclosureDetails/P31079152,01/26/2021
"OREGON SCHOOL BOARDS ASSOCIATION, FLEXFUND PROGRAM",Annual Financial Information and Operating Data,https://emma.msrb.org/MarketActivity/ContinuingDisclosureDetails/P31079152,01/26/2021
PALMDALE CALIF IMPT BD ACT 1915,Annual Financial Information and Operating Data,https://emma.msrb.org/MarketActivity/ContinuingDisclosureDetails/P31078915,01/26/2021
PARAMOUNT CALIF REDEV AGY TAX ALLOCATION,Annual Financial Information and Operating Data,https://emma.msrb.org/MarketActivity/ContinuingDisclosureDetails/P11112414,01/26/2021
PARAMOUNT REDEVELOPMENT AGENCY,Annual Financial Information and Operating Data,https://emma.msrb.org/MarketActivity/ContinuingDisclosureDetails/P11112414,01/26/2021
"PERU ELEMENTARY SCHOOL DISTRICT NUMBER 124, ILLINOIS LASALLE COUNTY",Annual Financial Information and Operating Data,https://emma.msrb.org/MarketActivity/ContinuingDisclosureDetails/P11112326,01/26/2021
"PHELPS COUNTY SCHOOL DISTRICT 0054 (BERTRAND COMMUNITY SCHOOLS), IN THE STATE OF NEBRASKA",Annual Financial Information and Operating Data,https://emma.msrb.org/MarketActivity/ContinuingDisclosureDetails/P31079076,01/26/2021
PINAL CNTY ARIZ UNI SCH DIST NO 43 APACHE JCT,Annual Financial Information and Operating Data,https://emma.msrb.org/MarketActivity/ContinuingDisclosureDetails/P31078893,01/26/2021
POLK CNTY ORE SCH DIST NO 002 DALLAS,Annual Financial Information and Operating Data,https://emma.msrb.org/MarketActivity/ContinuingDisclosureDetails/P11112594,01/26/2021
"PRINCETON TOWNSHIP HIGH SCHOOL DISTRICT NUMBER 500, BUREAU AND PUTNAM COUNTIES, ILLINOIS",Annual Financial Information and Operating Data,https://emma.msrb.org/MarketActivity/ContinuingDisclosureDetails/P11112333,01/26/2021
PROVIDENCE PUBLIC BUILDINGS AUTHORITY,Annual Financial Information and Operating Data,https://emma.msrb.org/MarketActivity/ContinuingDisclosureDetails/P11112554,01/26/2021
PROVIDENCE R I,Annual Financial Information and Operating Data,https://emma.msrb.org/MarketActivity/ContinuingDisclosureDetails/P11112554,01/26/2021
PROVIDENCE R I REDEV AGY CTFS PARTN,Annual Financial Information and Operating Data,https://emma.msrb.org/MarketActivity/ContinuingDisclosureDetails/P11112554,01/26/2021
PROVIDENCE R I REDEV AGY REV,Annual Financial Information and Operating Data,https://emma.msrb.org/MarketActivity/ContinuingDisclosureDetails/P11112554,01/26/2021
"PROVIDENCE REDEVELOPMENT AGENCY, RI",Annual Financial Information and Operating Data,https://emma.msrb.org/MarketActivity/ContinuingDisclosureDetails/P11112554,01/26/2021
PULASKI CNTY KY PUB PPTYS CORP FIRST MTG REV,Annual Financial Information and Operating Data,https://emma.msrb.org/MarketActivity/ContinuingDisclosureDetails/P11112530,01/26/2021
"PULASKI COUNTY PUBLIC PROPERTIES CORPORATION, KENTUCKY",Annual Financial Information and Operating Data,https://emma.msrb.org/MarketActivity/ContinuingDisclosureDetails/P11112530,01/26/2021
"PULASKI COUNTY, KENTUCKY",Annual Financial Information and Operating Data,https://emma.msrb.org/MarketActivity/ContinuingDisclosureDetails/P11112530,01/26/2021
RED RIVER AUTHORITY OF TEXAS,Annual Financial Information and Operating Data,https://emma.msrb.org/MarketActivity/ContinuingDisclosureDetails/P31078966,01/26/2021
REDWOOD CITY CALIF REDEV AGY TAX ALLOC REV,Annual Financial Information and Operating Data,https://emma.msrb.org/MarketActivity/ContinuingDisclosureDetails/P11112511,01/26/2021
"REGIONAL SCHOOL DISTRICT NO. 18 OF THE STATE OF CONNECTICUT (TOWNS OF LYME AND OLD LYME, CONNECTICUT)",Annual Financial Information and Operating Data,https://emma.msrb.org/MarketActivity/ContinuingDisclosureDetails/P11112321,01/26/2021
REGIONAL SCHOOL DISTRICT NUMBER 18,Annual Financial Information and Operating Data,https://emma.msrb.org/MarketActivity/ContinuingDisclosureDetails/P11112321,01/26/2021
REGIONAL SCHOOL DISTRICT NUMBER 18 OF THE STATE OF CONNECTICUT,Annual Financial Information and Operating Data,https://emma.msrb.org/MarketActivity/ContinuingDisclosureDetails/P11112321,01/26/2021
RHODE ISLAND HEALTH AND EDUCATIONAL BUILDING CORPORATION,Annual Financial Information and Operating Data,https://emma.msrb.org/MarketActivity/ContinuingDisclosureDetails/P11112554,01/26/2021
RHODE ISLAND HEALTH AND EDUCATIONAL BUILDING CORPORATION,Annual Financial Information and Operating Data,https://emma.msrb.org/MarketActivity/ContinuingDisclosureDetails/P11112465,01/26/2021
"RHODE ISLAND HEALTH AND EDUCATIONAL BUILDING CORPORTATION PROVIDENCE PUBLIC SCHOOLS REVENUE BOND FINANCING PROGRAM REVENUE BONDS, SERIES 2010A",Annual Financial Information and Operating Data,https://emma.msrb.org/MarketActivity/ContinuingDisclosureDetails/P11112554,01/26/2021
"RHODE ISLAND HEALTH AND EDUCATIONAL BUILDING CORPORTATION PROVIDENCE PUBLIC SCHOOLS REVENUE BOND FINANCING PROGRAM REVENUE BONDS, SERIES 2010B",Annual Financial Information and Operating Data,https://emma.msrb.org/MarketActivity/ContinuingDisclosureDetails/P11112554,01/26/2021
RHODE ISLAND ST HEALTH & EDL BLDG CORP REV,Annual Financial Information and Operating Data,https://emma.msrb.org/MarketActivity/ContinuingDisclosureDetails/P11112554,01/26/2021
RICHLAND CNTY S C,Annual Financial Information and Operating Data,https://emma.msrb.org/MarketActivity/ContinuingDisclosureDetails/P11112265,01/26/2021
RICHLAND COUNTY SOUTH CAROLINA,Annual Financial Information and Operating Data,https://emma.msrb.org/MarketActivity/ContinuingDisclosureDetails/P11112265,01/26/2021
"RICHLAND COUNTY, SOUTH CAROLINA",Annual Financial Information and Operating Data,https://emma.msrb.org/MarketActivity/ContinuingDisclosureDetails/P11112265,01/26/2021
"RICHLAND COUNTY, SOUTH CAROLINA BROAD RIVER SEWER SYSTEM",Annual Financial Information and Operating Data,https://emma.msrb.org/MarketActivity/ContinuingDisclosureDetails/P11112265,01/26/2021
